"sku","title","tags"
1103867650,"Create Handmade Repeat Patterns: Plus Turn Your Art into Wrapping Paper","Adobe Photoshop+Creative+Fine Art+Painting+Pattern Design+Product Design+Surface Design+Surface Pattern Design+Watercolors"
1104639413,"Showcase Your Artwork – Make Your Own Mockups | in Adobe Photoshop","Adobe Photoshop+Creative+Graphic Design+Illustration+Mockups+Pattern Design+Photo Editing"
1106709064,"Design a Female Character: Exploring Copic Markers","Character Design+Creative+Drawing+Fine Art+Illustration+Manga+Sketching+Staff Pick"
1107636202,"Fun & Simple Watercolor Cacti: 3 Color Themes","Art+Creative+Design Thinking+Fine Art+Illustration+Painting+Watercolors"
1108173734,"Animated Information Graphics: An Introduction to Maya 3D","3D Modeling+Animation+Creative+Data Visualization+Information Design+Motion Graphics+Skillshare Original"
1108321884,"iPad Art: Make Mesmerising Kaleidoscopic Bitmap & Vector Patterns","Creative+Design Patterns+Illustration+Ipad+Surface Design+Surface Pattern Design+Textiles+Vector+Vector Art"
1108670468,"Create a Repeating Pattern in 10 Minutes","Adobe Illustrator+Adobe Photoshop+Creative+Design Patterns+Graphic Design+Pattern Design+Surface Pattern Design+Vector Art+Vector Graphics"
1108711183,"Art Abroad: How to Create a Travel Sketchbook","Creative+Drawing+Illustration+Painting+Sketchbook+Staff Pick+Travel+Watercolors"
1109027672,"Unlocking Your Potential: 5 Exercises to Build Creative Confidence","Business+Career Development+Creativity+Entrepreneurship+Freelance & Entrepreneurship+Productivity+Professional Growth+Skillshare Original"
1109486316,"Writing for Brands: Freelancing in the Age of Content Marketing","Blogging+Business+Content Marketing+Contently+Marketing+Skillshare Original+Writing & Publishing"
1111783378,"Fundamentals of DSLR Photography","Camera+Creative+Digital Photography+Dslr+Justin Bridges+Photography+Skillshare Original"
1112362414,"Design a Pattern Collection: Streamline Your Workflow Using Adobe Draw and Illustrator","Adobe Illustrator+Creative+Design Patterns+Graphic Design+Illustration+Pattern Collection+Pattern Design+Surface Design+Surface Pattern Design"
1112462498,"React.js Academy for Beginners with Firebase","HTML+Javascript+React+Technology+Trello+Web Design+Web Development"
1113226023,"Mobile First & Responsive Web Design: Build Modern Websites!","Creative+CSS+HTML+Responsive Web Design+UI/UX Design+Web Design+Web Development"
1114386599,"Layouts for Lettering: Hierarchy, Composition, and Type Systems","Communication Design+Creative+Illustration+Layout Design+Lettering+Poster Design+Skillshare Original+Typeface Design"
1114741243,"Rainbow Portraits: Play and Experiment with Light","Adobe Lightroom+Camera+Creative+Lighting+Mobile Photography+Pets+Photography+Portrait Photography"
1116078103,"Illustration in Photoshop: Professional Work From Your Sketches","Adobe Photoshop+Character Design+Creative+Design+Digital Illustration+Drawing+Illustration"
1116158136,"Studio Fu: Carve Your Own Bamboo Pens","Creative+Drawing+Illustration+Sketchbook+Sketching+Surface Design+Woodworking"
1117308914,"The Business of Calligraphy: Pricing, Marketing & Freelancing for Lettering Artists","Business+Calligraphy+Freelance & Entrepreneurship+Lettering+Marketing+Networking+Pricing+Small Business+Work From Home"
1117412281,"Selling Online: Business Skills for Product Designers","Business+Business Development+Creative+Entrepreneurship+Product Design+Shapeways+Skillshare Original+UI/UX Design"
1117574085,"Experimental Image-Making: Creating Striking Images with Scanner Glitch Distortions","Adobe Photoshop+Art+Creative+Digital Illustration+Graphic Design+Illustration+Visual Arts"
1117884127,"Make Your Own Handmade Notebook | With Your Design On the Cover","Book Design+Crafts+Creativity+Design Projects+Graphic Design+Illustration+Lifestyle+Notebook+Product Design+Stationery"
1118593449,"Photoshop for Lunch™ - Color a Scanned Sketch - Blends, Brushes, Layer Styles","Adobe Photoshop+Art+Creative+Digital Illustration+Graphic Design+Illustration"
1121357392,"Learn to Paint Watercolor Goldfish","Color+Creative+Creativity+Fine Art+Illustration+Painting+Watercolors"
1121753698,"Easy Watercolor Sweets & Treats! Step by Step Beginner Level","Art+Creative+Creativity+Fine Art+Illustration+Painting+Watercolor Painting+Watercolors"
1121783876,"Pinhole Photography: from Matchbox to Working Camera","Art+Creative+DIY+Film Photography+Photography+Pinhole Photography+Visual Arts"
1122332203,"Watercolor Illustration: Developing a Wedding Brand Suite","Branding+Creative+Digital Illustration+Illustration+Painting+Skillshare Original+Watercolors+Wedding"
1122699248,"Skillshare Talks | Martina Flor on Cultivating Creative Side Projects to Grow Her Lettering Business","Business+Entrepreneurship+Freelance & Entrepreneurship"
1124525140,"The Designer's Guide to Writing and Research","Creative+Editorial Writing+Graphic Design+Research+Skillshare Original+Storytelling+Writing & Publishing"
1124634133,"Draw Anything: Basic Techniques for Realistic Proportions","Art+Creative+Drawing+Fine Art+Illustration+Proportions+Realistic Drawing"
1127147321,"Urban Sketching with Markers","Creative+Creativity+Drawing+Fine Art+Illustration+Sketching+Traveling+Urban Sketching"
1127290586,"Watercolor Painting for Mindfulness and Relaxation: Creative Self Care 2.0","Creative+Creativity+Fine Art+Mindfulness+Painting+Teacher Tools+Watercolor+Watercolor Painting+Watercolors"
1128307293,"Pathfinder: Design A Patch!","Adobe Illustrator+Creative+Digital Illustration+Drawing+Graphic Design+Illustration"
1129254486,"Short Films 101: Plan, Capture, and Edit Cinematic Shorts","Adobe Premiere+Cinematography+Creative+Film & Video+Film Editing+Film Production+Filmmaking+Skillshare Original"
1129330234,"Create magic with CSS – filters & blend modes for beginners","CSS+CSS Animations+CSS3+HTML+Technology+UI Design+Web Design+Web Development"
1130478463,"Illustrator for Lunch™ - Illustrating Cacti with Custom Made Brushes","Adobe Illustrator+Brushes+Creative+Design Skills+Design Techniques+Digital Illustration+Graphic Design+Illustration+Vector Art"
1131852197,"Video Essentials: Using Lenses & Lighting to Convey Emotion","Cinematography+Creative+DSLR Video+Film & Video+Skillshare Original+Video+Video Production+Visual Storytelling"
1134072078,"Logo Design: Create Geometric, Iconic, Wordmark, Monogram Styles","Branding+Creative+Design Projects+Graphic Design+Identity Design+Logo Design+Product Design+Vector Graphics"
1135693670,"Fundamentals of Photoshop: Typography and the Pen Tool (Photoshop III)","Adobe Photoshop+Creative+Graphic Design+Skillshare Original"
1137095224,"Digital Lettering: Control Your Curves and Enhance your Designs","Adobe Illustrator+Creative+Digital Illustration+Digital Lettering+Graphic Design+Hand Lettering+Illustration+Lettering+Logo Design"
1137620999,"Photoshop for Lunch™ - Make & Use Photo Brushes - Brushes, Masks, Watercolors","Adobe Photoshop+Creative+Design Techniques+Digital Illustration+Digital Photography+Graphic Design+Illustration+Post Production"
1137964638,"Goal-Setting for Creative Projects","Accountability+Business+Freelancing+Productivity+Project Management"
1139181169,"Easy Watercolors: Create a Love Inspired Card","Creative+Drawing+Fine Art+Illustration+Painting+Valentines+Visual Arts+Watercolors"
1139578500,"Photoshop for Lunch™ - Recolor Objects without Making Selections - Master Color Change Tools","Adobe Photoshop+Creative+Digital Illustration+Digital Photography+Graphic Design+Illustration"
1140447000,"Digital Illustration: Draw a Bowl of Soup","Creative+Illustration"
1140683775,"Create a Christmas Themed Postcard","Adobe Illustrator+Creative+Digital Illustration+Graphic Design+Illustration+Post Card+Print Design+Printmaking"
1141129555,"The Ultimate Guide to Text Animators in After Effects","Adobe After Effects+Animation+Creative+Motion Design+Motion Graphics+Typography"
1141497717,"Animation for Illustration: Adding Movement with Procreate & Photoshop","Adobe Photoshop+Animation+Creative+Gifs+Illustration+Procreate"
1141868303,"Business Planning for Creatives: Write Your Business Plan and Elevator Pitch","Business+Business Development+Business Plan+Creative Business+Entrepreneur+Entrepreneurship+Freelancing+Goal Setting"
1143989677,"Pattern Design in Illustrator Masterclass","Adobe Illustrator+Creative+Design Patterns+Design Techniques+Graphic Design+Scrapbooking+Spoonflower+Surface Pattern Design"
1146930544,"Watercolor Leaves: Painting Leaves in Different Styles","Creative+Creativity+Drawing+Fine Art+Painting+Visual Arts+Watercolors"
1149391061,"DIY Backdrops II: Custom Photography Textures","Creative+Digital Photography+IPhone+Lifestyle Photography+Lighting+Painting+Photography+Product Photography+Studio Setup"
1149670606,"Email Productivity: Work Smarter with Your Inbox","Business+Business Skills+Email+Productivity+Professional Growth+Skillshare Original+Tutorial"
1150005834,"How to Professionally Approach Art Buyers & Art Directors with Your Artwork","Business+Creative Business+Freelance & Entrepreneurship+Illustration+Surface Pattern Design"
1151837158,"Expressing Yourself With Personal Passion Projects","Creative+Drawing+Entrepreneurship+Graphic Design+Illustration+Skillshare Original"
1152159428,"Illustrator for Lunch™ - Create a Textured Dot Pattern - Transform, Vector Texture, Patterns","Adobe Illustrator+Creative+Digital Illustration+Graphic Design+Illustration+Surface Design"
1152572263,"Introduction to HTML: Build a Portfolio Website","Creative+CSS+HTML+Programming+Skillshare Original+UI/UX Design+Web Design"
1154735260,"Instagram for Business: Build an Engaged Community | Learn with Iconosquare","Business+Digital Marketing+Instagram+Marketing+Online Marketing+Skillshare Original+Small Business Marketing+Social Media Marketing"
1157138743,"Painting Tropical Flowers in Watercolor","Creative+Design Thinking+Illustration+Painting+Sketching+Surface Pattern Design+Watercolors"
1157437792,"iPhone Filmmaking: Create Cinematic Video With Your Phone","Creative+Film & Video+IPhone+Skillshare Original+Video+Video Editing+Video Production+Videography"
1158643137,"Illustrator for Lunch™ - Roaming Square Pattern","Adobe Illustrator+Creative+Design Patterns+Design Techniques+Digital Illustration+Graphic Design+Pattern Design+Surface Pattern Design+Vector Graphics"
1159965376,"Writing Fiction: 4 Exercises to Discover and Write Your Story","Creative+Creative Writing+Fiction+Skillshare Original+Storytelling+Writing+Writing & Publishing"
1160500136,"Powerful Portrait Photography: Capturing Personality","Creative+Documentary Photography+Dslr+Lifestyle Photography+Photography+Portrait Photography+Portraits+Skillshare Original"
1160577675,"Digital Character Illustration: Create A Memorable, Whimsical Character","Adobe Illustrator+Beginner+Character Design+Creative+Digital Illustration+Illustration+Pattern Design+Skillshare Original"
1161460951,"Introduction to Video Marketing: Plan, Produce & Publish to Drive Results","Business+Marketing+Online Marketing+Skillshare Original+Social Media Marketing+Video+Video Production"
1161785465,"Creating Trendy Abstract Patterns in Illustrator","Adobe Illustrator+Art+Creative+Digital Illustration+Graphic Design+Pattern Design+Surface Pattern Design+Vector Art"
1162886416,"Baugasm™ Series #6 - Design 3 Different Posters With Abstract Gradient Shapes in Photoshop","Adobe Photoshop+Creative+Design+Design Research+Graphic Design+Poster+Typography"
1165097734,"Photoshop for Lunch™ - Set up Colors, Tints and Shades for Working Smarter in Photoshop","Adobe Photoshop+Creative+Digital Illustration+Graphic Design+Illustration+Logo Design"
1166271949,"Edit PERFECT Images Using Only Your Phone: The Only 3 Apps You'll Ever Need","Art+Creative+Editing+Flat Design+IPhone+Mobile Apps+Photo Editing+Photography+Sharing Photos"
1166307888,"Watercolor: Smart Texturing In Photoshop","Adobe Photoshop+Creative+Design+Graphic Design+Texturing"
1167082215,"Illustrator for Lunch™ - Complex Rotated Repeating Patterns Made Easy - Using MadPattern templates","Adobe Illustrator+Creative+Digital Illustration+Graphic Design+Illustration+Pattern Design"
1167913433,"Creative Hand Lettering: Design Exercises with Image and Letters","Creative+Graphic Design+Hand Lettering+Illustration+Lettering+Photo Editing+Skillshare Original+Typography"
1169868274,"Beginning Steps to Creating Beautiful Hand Drawn Mandalas","Art+Creative+Creativity+Drawing+Fine Art+Illustration"
1170360090,"Adobe InDesign CC - Essentials Training Course","Adobe InDesign+Creative+Data Visualization+Editorial Design+Graphic Design+Information Design+Page Layout+Print Design+Publishing"
1170532766,"Design Thinking: How to Use Creative Problem Solving for Better Design","Creative+Design Research+Design Thinking+Ideation+Prototyping+Skillshare Original+UI/UX Design"
1170825650,"Digital Product Design: Build a Flexible Design System That Lasts","Creative+Design Research+Design Skills+Product Design+Skillshare Original+UI/UX Design+Web Design+Web Development"
1172240393,"Using Textures in Photoshop - A Photoshop for Lunch™ class","Adobe Photoshop+Compositing+Creative+Design Skills+Digital Photography+Graphic Design+Photo Editing+Surface Pattern Design+Textures"
1174385330,"iPad Art: Create Line Art and Coloring Pages in Procreate","Comic+Creative+Digital Illustration+Doodling+Drawing+Illustration+Ipad+Procreate"
1176971140,"Ghost Photography: Craft a Surreal Disappearing Portrait","Adobe Lightroom+Adobe Photoshop+Creative+Dslr+Photography+Portrait Photography+Portraits+Street Photography+Visual Storytelling"
1178684203,"Create a Repeating Pattern in Illustrator using Texture","Adobe Illustrator+Adobe Photoshop+Creative+Graphic Design+Illustration+Pattern Design+Surface Design+Surface Pattern Design+Vector"
1179888665,"Fashion Design: Introduction to Hand Drawn Technical Flats","Creative+Fashion Design+Garment Flats+Graphic Design+Rendering+Sketching+Skillshare Original"
1179980082,"Mobile Editing For Instagram Photos","Adobe Lightroom+Color Correction+Creative+Instagram+Instagram Marketing+Mobile Apps+Photo Editing+Photography+Social Media"
1180794385,"Fundamentals of Lightroom II: Editing and Post Processing","Adobe Lightroom+Adobe Photoshop+Creative+Digital Photography+Photography+Skillshare Original"
1182020092,"Instagram Poetry: Create Personal, Visual Vignettes for Self-Expression","Creative+Creative Writing+Instagram+Journaling+Poetry+Skillshare Original+Writing"
1184263173,"Gel Transfers: Make Your Own Simple Photo Prints","Art+Creative+Digital Photography+Drawing+Graphic Design+Illustration+Photography"
1185122150,"Find Your Line: Develop Your Drawing Style","Creative+Drawing+Fashion Illustration+Figure Drawing+Fine Art+Illustration+Sketchbook+Sketching"
1186449914,"Acrylic Painting: Learn the Basics For Beginners","Acrylic+Art+Color+Color Mixing+Creative+Fine Art+Painting+Watercolors"
1186754238,"Intro to UX: Conducting Smart User Research","Business+Creative+Design Research+Product Design+UI/UX Design+User Experience+UserTesting+UX Design"
1186813907,"Flourished Calligraphy Layouts with Procreate for iPad Pro","Calligraphy+Creative+Flourishing+Illustration+Ipad+Layout Design+Lettering+Procreate"
1187743623,"Learning How to Draw: A Mindset, Method, and Exercises","Comic Art+Creative+Drawing+Illustration+Rendering+Skillshare Original"
1188255402,"Photoshop Efficiency - Techniques For Consistent Marketing","Adobe Photoshop+Creative+Graphic Design+Identity Design+Productivity+Retouching+Social Media Advertising+Web Graphics"
1188374162,"Responsive HTML Email Development","CSS+Email+Email Marketing+HTML+Responsive Web Design+Technology+Web Development"
1191430819,"Photoshop for Lunch™ - Clean & Color Scanned Line Art","Adobe Photoshop+Creative+Digital Illustration+Graphic Design+Illustration+Surface Design"
1191458218,"Excel for the Real World II: Double Your Excel Speed with Keyboard Shortcuts","Analytics+Business+Business Analytics+Business Modeling+Data Visualization+Excel+Skillshare Original+Spreadsheets"
1192081811,"Find Your Illustration Style in 6 Simple Experiments","Creative+Creative Insights+Drawing+Illustration+Mastering+Painting+Visual Arts+Watercolors"
1194474871,"Video SEO: Adding Keywords to Your Videos and Youtube video SEO","Business+Entrepeneurship+Entrepreneurship+Online Marketing+SEO+Video Editing+Video SEO"
1194757260,"Explore Green in a Step-by-step Watercolor Painting Class","Bird+Creative+Fine Art+Illustration+Painting+Watercolor+Watercolor Painting+Watercolors"
1195425836,"How to use Google Analytics to set your SEO strategy","Business+Digital Marketing+Digital Strategy+Google Analytics+Marketing+Search Engine Marketing+Search Engine Optimization+SEO"
1195481754,"Learn Mobile Photo Editing: Apps for Beauty and Efficiency","Creative+Digital Photography+Instagram+Lifestyle Photography+Photo Editing+Photography+Skillshare Original+Snapseed"
1196661564,"3-D Illustration: Space, Color & Texture","Adobe Photoshop+Cinema 4D+Creative+Digital Illustration+Graphic Design+Illustration+Skillshare Original"
1196902414,"Brand Resolutions 2020 - Goal setting for the next decade","Branding+Business+Business Planning+Freelance & Entrepreneurship+Marketing+Productivity"
1197462143,"Creating A Microscopic Still Life In Cinema 4D","3D+Adobe Photoshop+Animation+Cinema 4D+Creative+Graphic Design+Motion Graphics+Visual Effects"
1199194459,"Branding Your Creative Business: Define Your Brand","Business+Business Development+Craft+Creativity & Innovation+Entrepreneurship+Marketing+Personal Branding"
1200154057,"Design a Logo in Modern Style","Adobe Illustrator+Branding+Creative+Digital Illustration+Graphic Design+Illustration+Logo Design+Skillshare Original"
1200576262,"Mark Your Memories: Make an Illustrated Milestone Map | A Creative Exercise for Any Level","Brainstorming+Creative+Design Thinking+Digital Illustration+Ideation+Illustration+Journaling+Staff Pick"
1200750634,"Rock Poster Design: From Concept Development to Execution","Creative+Design Research+Illustration+Poster Design+Skillshare Original+Typography"
1204036269,"Leverage Pinterest for Your Creative Business: Strategies for Attracting Clients","Business+Creative+Creative Business+Illustration+Marketing+Pinterest+Social Media+Social Media Advertising+Social Media Marketing"
1205014536,"Ink & Watercolor Magic: 5 Step By Step Illustrations","Art+Creative+Drawing+Fine Art+Illustration+Painting+Watercolor Painting+Watercolors"
1206714333,"Leadership Today: Using Coaching & Questions to Grow Your Business","Business+Business Development+Business Skills+Career Development+Leadership+Management+Professional Growth+Skillshare Original"
1209375745,"Secrets, Tips & Tricks to Finding Your Voice as an Artist","Creative+Creative Insights+Creativity+Drawing+Fine Art+Ideation+Illustration+Painting+Sketchbook"
1209974470,"Knitting III: Learn Knitting in the Round with a Slouchy Hat","Crafts+DIY+Knit For Beginners+Knitting+Knitwear+Lifestyle+Sewing+Skillshare Original"
1212645241,"Spring Color Trends 2019 - Learn to Mix Beautiful Color Schemes","Art+Color+Color Theory+Color Trends+Creative+Fine Art+Watercolors"
1213169741,"Photoshop for Lunch™ - Cutout & Frame Photos - Clipping Mask, Layer Mask, Rotation, Shapes","Adobe Photoshop+Creative+Digital Illustration+Digital Photography+Graphic Design+Illustration+Logo Design"
1213408781,"The Art of Paper Marbling: Explore Monotype on Water","Creative+Fine Art+Gouache+Illustration+Painting+Pattern Design+Staff Pick+Watercolors"
1215496622,"HTML & CSS Coding for Beginners: Build your own portfolio!","CSS3+HTML5+Portfolio+Responsive Design+Technology+Web Development"
1216113962,"Sketching With Markers: Draw a Cotton Branch","Art+Creative+Drawing+Illustration+Markers+Sketchbook+Sketching"
1216254096,"Textured Toast: Dramatic Side-Lit Photography","Adobe Lightroom+Creative+Food Photography+Lifestyle Photography+Lighting+Photographic Composition+Photography+Post Production+Styling"
1216463236,"SEO: Performing a Content Audit","Analytics+Big Data+Business+Digital Strategy+Google+Google Analytics+Marketing+Search Console+SEO"
1216959000,"Productivity Habits That Stick: Using Time Theming","Business+Business Skills+Personal Development+Productivity+Skillshare Original+Time Management+Todoist"
1217505584,"PLEIN AIR PAINTING WITH WATERCOLORS 101 - SUPPLIES AND GEAR","Creative+Fine Art+Gouache+Illustration+Painting+Watercolor Painting+Watercolors"
1217750153,"iPad Art: Create a Monster - An Introduction to Procreate","Character Design+Creative+Digital Illustration+Digital Painting+Illustration+IOS+Ipad+Procreate"
1218931395,"Unlock Your Creativity: Learn to Think Like a Designer","Challenge+Creative+Creativity+Design Projects+Graphic Design+Logo Design"
1219576917,"Art Licensing Fundamentals: Finding Buyers for Your Art","Art Licensing+Business+Business Development+Business Skills+Creative Insights+Design Research+Freelance & Entrepreneurship+Small Business Marketing+Surface Design"
1221540626,"Product Marketing: Creating Compelling Brand Imagery","Branding+Business+Fashion+Fashion Photography+Marketing"
1223060016,"The Art of Revision: How to Make Your Good Film, Great in 6 Steps","Adobe Premiere+Creative+Documentary+Film Editing+Film Production+Filmmaking+Video Editing+Video Production+Visual Storytelling"
1225152530,"Exploring Photographic Style: The Power of “Wonderlust” Imagery","Creative+Digital Photography+Getty Images+Instagram+Lifestyle Photography+Photographic Composition+Photography+Skillshare Original"
1225674247,"Illustrator for Lunch™ - Complex Block and Half Drop Repeat patterns - DIY Large Patterns","Adobe Illustrator+Creative+Design Patterns+Design Skills+Digital Illustration+Graphic Design+Pattern Design+Surface Pattern Design+Vector Graphics"
1226300666,"Introduction to CSS: Add Fundamental Styles to a Portfolio Website","Creative+CSS+HTML+Programming+Skillshare Original+UI/UX Design+Web Design"
1226575189,"WordPress 5 Theme Development Academy with Bootstrap v4","Bootstrap+CSS+HTML+Php+Responsive Design+Technology+Web Development+WordPress"
1227113905,"painting watercolor seascapes","Art+Creative+Creativity+Drawing+Fine Art+Illustration+Painting+Watercolors"
1228094620,"Illustrator for Lunch™ - 4 Handy Patterns - Diagonals, Plaid, Colorful Dots, Chevron","Adobe Illustrator+Creative+Digital Illustration+Graphic Design+Illustration+Logo Design"
1229064110,"Draw A Diary Comic","Comics+Creative+Drawing+Illustration+Sketchbook+Storytelling+Visual Storytelling+Webcomics"
1229859754,"Photoshop for Lunch™ - Metaball Patterns - Structured and Organic","Adobe Photoshop+Creative+Design Skills+Digital Illustration+Graphic Design+Illustration+Pattern Design+Surface Pattern Design"
1230386544,"The ABCs of Brush Pen Lettering |  Learn The Miniscule (Lowercase) Alphabet in 20 Minutes!","Brush Calligraphy+Brush Lettering+Brush Pen+Brush Pen Lettering+Calligraphy+Creative+Hand Lettering+Illustration+Lettering"
1230828232,"The Art of Bunnies in Books: an Easter Illustration Celebration","Art+Book Design+Character Design+Creative+Drawing+Illustration+Sketching+Watercolors"
1231211673,"unavailable","Art+Creative+Illustration+Watercolors"
1232285789,"Gouache Florals: Explore Shape, Color and Creative Composition","Acrylic+Creative+Creativity+Drawing+Gouache+Illustration+Painting+Pattern Design+Watercolors"
1232514354,"Poster Design: Textures and Halftones for Screen Printing","Creative+Digital Illustration+Illustration+Poster Design+Screen Printing+Skillshare Original+Textures"
1232592490,"Character Design Crash Course: Develop Expressive Characters Through Caricature","Caricature+Character Design+Creative+Digital Illustration+Drawing+Illustration+Portrait Drawing+Portraits"
1233233581,"Microsoft Word 2016 - Word Bootcamp - Zero to Hero Training","Business+Digital Publishing+Marketing+Microsoft+Microsoft Office+Microsoft Word+Productivity+Software+Word Processing+Writing & Publishing"
1233615941,"painting white in watercolor","Art+Color+Creative+Fine Art+Painting+Visual Arts+Watercolors"
1234335046,"Sketchbook Practice: Make Everyday Objects Pop With Watercolor and Pen","Creative+Illustration+Painting+Sketchbook+Sketching+Watercolors"
1235578619,"Abstract Watercolor Paintings: Explore Through Freeform & Planned Process","Color+Creative+Creativity+Fine Art+Home Decor+Illustration+Painting+Watercolors"
1235824112,"Watercolor Sunflowers: Painting Sunflowers in 3 styles","Creative+Creativity+Fine Art+Illustration+Painting+Visual Arts+Watercolors"
1236134695,"William Morris Style Pattern: three ways of Creating a Botanical Design in Photoshop and by hand","Adobe Photoshop+Creative+Digital Illustration+Digital Painting+Drawing+Graphic Design+Illustration+Pattern Design"
1237491406,"Patterns By Hand: Sketch a Geometric Design","Creative+Illustration+Pattern Design+Product Design+Skillshare Original+Surface Design"
1238348928,"Learn to Think Differently","Business+Creative+Creativity+Ideation+Leadership+Skillshare Original"
1238815768,"What's in my Bag: A contemporary take on the classic self portrait.","Creative+Digital Illustration+Drawing+Fashion Illustration+Illustration+Line Drawing+Portraits+Sketching"
1240443202,"How to Design and Create a Digital Planner / Journal on Your iPad in Procreate + a FREE Planner","Bullet Journaling+Creative+Digital Illustration+Digital Planner+Digital Planning+Graphic Design+Illustration+Ipad"
1242446240,"Building a Productive Creative Business: The How & Why of Scaling","Business+Entrepreneurship+Graphic Design+Mama's Sauce+Operations+Skillshare Original+Small Business"
1244630685,"Building Character 1: Design and Sketch Your Character","Character Design+Creative+Design+Drawing+Illustration+Sketching"
