"sku","title","tags"
1526803428,"Improvising Comics: Techniques to Generate Funny Ideas","Comics+Creative+Digital Illustration+Drawing+Illustration+Skillshare Original+Web Comics"
1527968272,"Baugasm™ Series #7 - Design an abstract poster with liquid effect in Photoshop","Abstract+Adobe Photoshop+COlors+Creative+Gradient+Graphic Design+Layout Design+Poster"
1529926415,"LOGO DESIGN - A journey through a logo design project","Creative+Design Projects+Design Research+Freelancing+Graphic Design+Identity Design+Logo+Logo Design"
1530569374,"Documentary Photography: Capturing Places and People","Creative+Digital Photography+Documentary Photography+Photography+Skillshare Original+Street Photography+Travel Photography"
1530782475,"Hand Lettering With Texture: Creating Analog, Dimensional Type","Creative+Hand Lettering+Illustration+Lettering+Skillshare Original+Typography"
1530988253,"Drawing to Pattern in Illustrator - an Illustrator for Lunch™ class","Adobe Illustrator+Creative+Design Patterns+Digital Illustration+Graphic Design+Illustration+Pattern Design+Surface Pattern Design+Textiles"
1531197349,"Watercolor Holiday Florals","Botanical+Creative+Fine Art+Floral+Illustration+Painting+Surface Design+Watercolor Painting+Watercolors"
1531560564,"Designing with Spirals - An Illustrator for Lunch™ Class","Adobe Illustrator+Creative+Design Skills+Digital Illustration+Graphic Design+Illustration+Pattern Design+Scrapbooking+Surface Pattern Design"
1533305896,"Easy Setup For Print: Design a Unique Business Card","Adobe Illustrator+Adobe InDesign+Adobe Photoshop+Creative+Graphic Design+Typography"
1535267347,"Let's Play! Overcome the Inner Critic & Get Into the Flow State With Watercolors!","Art+Creative+Creativity+Fine Art+Illustration+Painting+Watercolor Painting+Watercolors"
1537238177,"Modern Journaling: Integrating Mindful Journaling and Productive Planning","Creative Insights+Creativity+Doodle+Health & Wellness+Journaling+Lifestyle+Mindfulness+Self Care"
1538913998,"Modern Leadership: Give & Get Honest Feedback at Work","Business+Business Skills+Career Development+Human Resources+Leadership+Management+Professional Growth+Skillshare Original"
1539782161,"Graphic Design Basics: Core Principles for Visual Design","Art+Creative+Fine Art+Graphic Design+MICA+Skillshare Original+Visual Arts+Visual Storytelling"
1540369150,"Fundamentals of Lightroom I: Organize Files and Boost Your Workflow","Adobe Lightroom+Adobe Photoshop+Creative+Digital Photography+Photography+Skillshare Original"
1541058998,"Going Pro with Portrait Photography: How to Turn Your Photography Hobby into a Job","Business Development+Creative+Digital Photography+Freelance & Entrepreneurship+Lifestyle Photography+Marketing+Photography+Portrait Photography+Pricing"
1542694082,"Filming Scene Transitions: Creative Techniques on a Budget","Creative+Film Production+Filmmaking+Skillshare Original+Video Editing+Video Production+Videography"
1543954168,"Sketchbook Practice : Create Freely with Ink and Watercolor","Creative+Fine Art+Illustration+Ink+Journaling+Painting+Sketch+Sketchbook+Watercolors"
1544174240,"Watercolor: 9 Tropical Leaves","Color+Creative+Design Thinking+Drawing+Fine Art+Illustration+Painting+Sketchbook+Watercolors"
1544631863,"Extruding Type with Photoshop 3D","3D Design+Adobe Photoshop+Animation+Creative+Design+Graphic Design+Typography"
1545330834,"Donut Flat Lays: Tips for Better Overhead Photos","Adobe Lightroom+Creative+Digital Photography+Flat Lay+IPhone+Lifestyle Photography+Lighting+Photographic Composition+Photography"
1548517565,"Creative Digital Illustration: Learn to Use Adobe Fresco","Adobe Fresco+Color+Creative+Digital Illustration+Illustration+Ipad+Skillshare Original"
1550416995,"Explorative Design: Develop Your Style Rapidly and Sustainably","Adobe Illustrator+Creative+Creativity+Creativity & Innovation+Design Projects+Graphic Design+Illustration"
1551071522,"Learn How To Master Songs Like A Pro All From Home With Young Guru","Audio+Creative+Music Industry+Music Production+Music Recording+Recording+Skillshare Original"
1551614034,"Sketchbook Practice : Using Pens to Explore Negative Space","Creative+Illustration+Painting+Sketchbook+Textures+Tutorial+Watercolors"
1551945410,"Boost Personal Branding by Coding Your Own Website (HTML & CSS Basics)","CSS+HTML+Personal Branding+Personal Website+Staff Pick+Technology+Web Design+Web Development"
1552128361,"What's in your Lettering Toolbox? Know Your Hand Lettering Tools Like a Pro!","Calligraphy+Creative+Hand Lettering+Illustration+Journaling+Lettering+Script+Typography+Watercolors"
1552457321,"Inky Illustrations: Combining Analogue and Digital Media","Adobe Photoshop+Creative+Illustration+Personal Branding+Texture+Vintage"
1552743486,"Skillshare Talks | Self-Taught to Self-Employed: Peggy Dean on Building Her Creative Career","Business+Business Development+Calligraphy+DIY+Entrepreneurship+Freelance & Entrepreneurship+Hand Lettering+Illustration+Lettering"
1552954793,"Simple Character Animation: Create a Walk Cycle with Duik","Adobe After Effects+Animation+Character Animation+Creative+DuIK+Skillshare Original"
1555494226,"Photoshop for Lunch™ - Overlapping and Random Circles Patterns","Adobe Photoshop+Creative+Design Patterns+Design Techniques+Digital Illustration+Graphic Design+Illustration+Surface Pattern Design"
1556517414,"Design an Illustrative Game Logo in Illustrator","Adobe Illustrator+Creative+Design+Digital Illustration+Game Design+Illustration+Logo Design+Vector"
1557988282,"Create Inspiration Boards & Streamline Your Artistic Process","Art+Concept Design+Creative+Digital Illustration+Drawing+Illustration+Painting+Sketching"
1558306049,"How to Live Online: 5 Ways to Shape Your Digital World","Business+Personal Development+Productivity+Professional Growth+Skillshare Original+Social Media+Time Management"
1558815551,"Digitize Your Lettering: 3 Easy Methods","Adobe Illustrator+Adobe Photoshop+Calligraphy+Creative+Hand Lettering+Illustration+Lettering+Photo Retouching+Scanning"
1559005110,"Easy Isometric Art in Illustrator - An Illustrator for Lunch™ course","Adobe Illustrator+Creative+Digital Illustration+Graphic Design+Icon Design+Illustration+Infographics+Isometric+Vector Art"
1560213257,"Building Character 2: Inking Your Character","Character Design+Creative+Design+Drawing+Illustration+Inking"
1560399462,"Create Your Own Font on the iPad","Creative+Graphic Design+Handwriting+Ipad+Lettering+Typography+Vector Graphics+Web Fonts"
1561711993,"Get creative with the HTML5 Canvas","Canvas+Creative+HTML5+Javascript+Technology+UI/UX Design+Web Design+Web Development"
1562642209,"The Basics of Color Mixing in Watercolor","Color+Color Theory+Creative+Creativity+Fine Art+Painting+Visual Arts+Watercolors"
1564055279,"iPhone Photography: How to Take Pro Photos On Your iPhone","Creative+Digital Photography+IPhone+Nature Photography+Photographic Composition+Photography+Staff Pick+Travel Photography"
1566710562,"DIY Cinematography: Make Your Video Look Like a Movie","Cinematography+Creative+Digital Photography+Film Production+Filmmaking+Skillshare Original+Videography"
1567272322,"Design With Watercolors: Your Own Postcard Set From Sketch to Ready For Print File","Adobe Illustrator+Creative+Graphic Design+Illustration+Painting+Watercolors"
1571144223,"Adobe Camera Raw and Lightroom for Lunch™ - High Key Image Processing","Adobe Camera Raw+Adobe Lightroom+Adobe Photoshop+Creative+Digital Photography+Photo Editing+Photography+Post Production"
1571370270,"Beginner HTML & CSS: Build your own personal blog!","Blogging+CSS+Entrepreneurship+HTML+Responsive Web Design+Technology+Web Design+Web Development"
1574710151,"How to Paint: Watercolor Houseplants | Boston Fern","Color Theory+Creative+Fine Art+Illustration+Painting+Watercolors"
1574976051,"Painting Light and Shadow: The Basics for Portraits and Characters","Creative+Digital Illustration+Drawing+Illustration+Painting+Portraits+Sketching+Staff Pick"
1575146775,"Hand-Code Your First Website: HTML + CSS Basics","Coding+CSS+CSS3+HTML+Technology+Web Design+Web Development+Website"
1576258016,"Fundamentals of Photoshop: Creating Efficient Workflows, Tips, and Tricks (Photoshop V)","Adobe Photoshop+Creative+Graphic Design+Skillshare Original"
1576772990,"Doodle Art: Curvy and Organic Designs","Creative+Creativity+Doodling+Drawing+Graphic Design+Illustration+Sketchbook+Surface Design"
1578771451,"Summer Color Trends 2019: Learn to Mix beautiful Colors in Watercolor","Color Theory+Creative+Fine Art+Illustration+Painting+Trends+Watercolors"
1579462797,"Alpha Lock, Clipping Mask, Layer Mask: in Procreate and Photoshop","Adobe Photoshop+Creative+Design Patterns+Digital Illustration+Drawing+Graphic Design+Illustration+Ipad+Procreate"
1581992558,"User Experience Design Essentials - Adobe XD UI UX Design","Adobe Photoshop+App Design+Creative+Prototyping+UI/UX Design+User Experience+User Interface+Web Design"
1583544555,"Mastering Illustrator: 10 Tips & Tricks to Speed Up Your Workflow","Adobe Illustrator+Creative+Digital Illustration+Graphic Design+Illustration+Logo Design+Skillshare Original"
1587413425,"Shortcuts to Map Making for Illustrators: Illustrate Your Favorite City","Adobe Photoshop+Creative+Digital Illustration+Illustration+Map Design"
1589076170,"Watercolor Basics: Paint Your Own Patterned Note Cards","Beginner+Creative+Graphic Design+Illustration+Painting+Pattern Design+Stationery+Surface Design+Watercolors"
1589186757,"Art School Boot Camp I: Drawing Compelling Compositions","Art+Creative+Drawing+Fine Art+Illustration"
1590736356,"Character Animation Basics: Create a Dance Loop with After Effects and Photoshop","Adobe After Effects+Adobe Photoshop+Animation+Character Animation+Creative+Gifs+Skillshare Original"
1591358236,"Illustrator for Lunch™ - Going in Circles - Brushes, Blends & Transformations","Adobe Illustrator+Creative+Digital Illustration+Graphic Design+Illustration+Pattern Design"
1592854101,"Adorn Your Holiday Packages with Watercolor","Crafts+Creativity+DIY+Gift Tags+Holiday+Paper+Watercolors"
1596053755,"The Art of Color: Using Color in Your Design Work","Color+Color Theory+Creative+Design+Graphic Design+Illustration+Pattern Design"
1597015420,"Painting with Thread: Modern Embroidery for Beginners","Color+Crafts+Embroidery+Fiber Art+Illustration+Lifestyle+Sewing+Skillshare Original+Textiles"
1597149318,"Super Vision: Intro to Eyewear Design","Accessories Design+Creative+Design Research+Fashion Design+Graphic Design+Sketching+Skillshare Original"
1598567171,"Content Marketing: Create a One-Minute Video","Business+Entrepreneurship+Film Editing+Filmmaking+Marketing+Skillshare Original+Video Editing"
1598778222,"Writing Fiction: 5 Exercises to Craft a Compelling Plot","Creative+Creative Writing+Plot+Skillshare Original+Storytelling+Writing"
1600155486,"Going Viral: Write, Film & Make Content People Share","Comedy+Content Marketing+Creative+Humor Writing+Social Media+Twitter+Video+Writing+Youtube"
1601060223,"Creating A Realistic Still Life in Cinema 4D","3D Design+Adobe Camera Raw+Adobe Photoshop+Animation+Cinema 4D+Creative+Graphic Design"
1601834291,"Adobe Camera Raw and Lightroom for Lunch™ - Enhance Red when Processing Your Photos","Adobe Camera Raw+Adobe Lightroom+Adobe Photoshop+Creative+Digital Photography+Photo Editing+Photography+Post Production"
1602223843,"Digitising Watercolors. Step-by-step Guide","Adobe Illustrator+Adobe Photoshop+Creative+Digital Illustration+Graphic Design+Illustration+Watercolors"
1602555159,"12 Things I Wish I'd Known as a Beginner Artist","Art+Creative+Drawing+Entrepreneurship+Freelance & Entrepreneurship+Freelancing+Graphic Design+Illustration"
1602595214,"Make Creativity Your Career: Six Exercises to Create a Successful Side Project","Business+Career Development+Creativity+Freelance & Entrepreneurship+Illustration+Personal Branding+Personal Development+Professional Growth+Skillshare Original"
1603696556,"Surface Pattern Design 2.0: Design a Collection | Start a Career","Adobe Illustrator+Career+Collection+Creative+Design+Pattern Design+Surface Pattern Design"
1604427752,"Packaging Your Fashion Brand: Developing Hangtags, Labels, and More","Business+Creative+Entrepreneurship+Fashion Design+Marketing+Product Design+UI/UX Design"
1604659156,"Teacher Tips: Producing A Successful Skillshare Class","Business Skills+Entrepreneurship+Freelance & Entrepreneurship+Lifestyle+Skillshare+Teaching"
1606007032,"Watercolors Secrets: Seven Tips to Level-Up your Art","Creative+Drawing+Fine Art+Illustration+Painting+Watercolor+Watercolor Painting+Watercolors"
1609992331,"Creating On The Ipad - Turning Your Sketches Into Whimsical Art","Creative+Digital Painting+Drawing+Illustration+Ipad+Procreate+Sketching"
1613282319,"Debt Financing: Funding Your Small Business The Smart Way","Bond Street+Business+Entrepreneurship+Finance+Professional Growth+Skillshare Original+Small Business"
1614197409,"Intro to Surface Pattern Design: Learn Adobe Illustrator","Adobe Illustrator+Creative+Illustration+Pattern Design+Surface Design+Surface Pattern Design"
1614690814,"Painting a Watercolor Poppy : explore 3 watercolor styles","Color+Creative+Drawing+Fine Art+Illustration+Painting+Watercolors"
1614992610,"Illustrator Secrets: 5 Techniques to Add Realism to Your Work","Adobe Illustrator+Creative+Graphic Design+Skillshare Original+Vector Art+Vector Graphics"
1616616039,"Photoshop Demystified: A Beginner's Guide to Digital Painting","Adobe Photoshop+Art+Creative+Digital Illustration+Drawing+Illustration+Painting+Sketching"
1617538757,"Design a Fabric Collection: Everything you need to know about designing for the fabric industry.","Creative+Fabric Collection+Illustration+Pattern Design+Textiles"
1618762074,"Contours / Drawing with Compelling Contours & Foreshortening","Art+Creative+Creativity+Drawing+Fine Art+Illustration+Visual Arts"
1618895256,"Creative Thinking with Constraints: Designing Logos of the Future","Adobe Illustrator+Branding+Creative+Creativity+Illustration+Logo Design+Skillshare Original"
1619441569,"Illustrator for Lunch™ - Circle Based Patterns - Rotate, Blend, Multi-Color Dots","Adobe Illustrator+Creative+Digital Illustration+Graphic Design+Illustration+Pattern Design"
1619836239,"Host an Art Party: Prompts & Themes for Drawing with Friends","Creative+Creativity+Drawing+Graphic Design+Illustration+Skillshare Original"
1621763773,"Creative Video Storytelling & Editing: Making the Most of Stock Footage","Creative+Film Production+Skillshare Original+Stock Video+Storytelling+Video Editing+Visual Storytelling"
1625291982,"Autumn Watercolors: 5 Easy Fall Paintings","Creative+Drawing+Fine Art+Illustration+Painting+Watercolors"
1626271436,"Motion Graphics in Cinema 4D: Design an 80s-Inspired Animated GIF","3D Animation+3D Design+Adobe Photoshop+Animation+Cinema 4D+Creative+Gifs+Skillshare Original"
1627503528,"Presentations: Craft the Best Content, Tell the Best Story","Business+Business Development+Entrepreneurship+Information Design+Leadership+Marketing+Skillshare Original+Writing & Publishing"
1628348234,"Intro to Illustration In Adobe Illustrator","Adobe Illustrator+Creative+Drawing+Graphic Design+Illustration+Vector+Vector Art+Vector Graphics"
1629079676,"Travel Photography: Seeing, Shooting, and Editing","Creative+Digital Photography+Film Photography+Mobile Photography+Photo Editing+Photography+Skillshare Original+Travel Photography"
1630069482,"From Intermediate to Advanced Filmmaker: 7 Things You Need to Know","Cinematography+Creative+Documentary+Dslr+Film Production+Filmmaking+Video+Video Production+Videography"
1630073824,"Master Watercolor Techniques: Learn to Paint a Watercolor Succulent","Creative+Fine Art+Paint Succulent+Paint Watercolor+Succulent+Watercolor Painting+Watercolor Techniques"
1630105699,"Catch Em All! Draw your Team's Badge in Adobe Illustrator.","Adobe Illustrator+Creative+Drawing+Graphic Design+Illustration+Pokemon"
1630671081,"Botanical Illustrations on Your iPad in Procreate + 15 Free Procreate Brushes","Creative+Digital Illustration+Graphic Design+Illustration+Ipad+Ipad Procreate+Procreate+Surface Pattern Design"
1631601456,"Introduction to Photoshop: Basic Skills + 3 DIY Projects","Adobe Photoshop+Creative+Graphic Design+Skillshare Original"
1632449298,"Find Your Brand Focus: A Brand First Workshop","Branding+Business+Content Strategy+Design Thinking+Marketing+Personal Branding"
1635326606,"Photoshop for Lunch™ - Surreal Collage Effect - Paths, Cloning, Warp, Blend","Adobe Photoshop+Art+Creative+Digital Illustration+Graphic Design+Illustration"
1635926328,"Illustrator for Lunch™ - Create Seasonal Ornaments - Learn new skills while making seasonal art","Adobe Illustrator+Creative+Design Techniques+Digital Illustration+Graphic Design+Illustration+Scrapbooking+Surface Pattern Design+Vector Art"
1636459821,"Brand Illustration: Create Unforgettable, Stylized Brand Imagery","Branding+Creative+Design Business+Illustration+Skillshare Original"
1636956242,"How to Make a Podcast: Plan, Record, and Launch with Success","Anchor+Content Strategy+Creative+Digital Strategy+Journalism+Podcasting+Skillshare Original+Writing"
1637054405,"Watercolors & Masking Fluid Techniques","Creative+Design+Illustration+MASKING+Painting+Watercolors"
1638213519,"Illustrator for Lunch™ - Create with bends and blends - techniques for icons, logos and more","Adobe Illustrator+Creative+Design Skills+Digital Illustration+Graphic Design+Icon Design+Logo Design+Surface Pattern Design+Vector Graphics"
1638752581,"Creative Exercises: 6 Prompts for Fun Doodles & Creative Play","Art+Creative+Creativity+Drawing+Fine Art+Inspiration+Painting+Skillshare Original"
1640895809,"Watercolour: How to Paint Snow Globes","Art+Creative+Fine Art+Illustration+Painting+Watercolors"
1641877791,"Career Development: Creating an Action Plan with Design Thinking","Business+Business Skills+Career Development+Leadership+Professional Growth+Skillshare Original"
1643583924,"Painting Fur - Mastering the Wet on Wet Technique","Animal Painting+Creative+Fine Art+Watercolor+Watercolor Painting+Watercolors+Wet On Wet"
1644132153,"Watercolors for All - Fun + Simple Exercises to Get Started","Beginner+Character Design+Creative+Floral+Illustration+Painting+Watercolor+Watercolor Painting+Watercolors"
1648058660,"Make Your Own Chat Stickers! A Character Design and Vector Coloring Exercise","Character Design+Comics+Creative+Digital Illustration+Illustration+Mobile Apps+Visual Communication"
1648806561,"Photoshop for Lunch™ - In the Footsteps of Warhol - Create Awesome Animal Images","Adobe Photoshop+Creative+Design Techniques+Digital Illustration+Digital Photography+Graphic Design+Illustration+Photo Editing"
1650160370,"Advanced Techniques in Surface Pattern Design","Creative+Design Techniques+Illustration+Print Design+Surface Design+Surface Pattern Design+Textiles+Vector"
1650606769,"Layouts For Lettering | Beginner Tips For Creating Quote Layouts With Your Lettering","Calligraphy+Creative+Drawing+Fine Art+Graphic Design+Hand Lettering+Handwriting+Illustration+Lettering"
1652999494,"Cold Brew Coffee Swirl: Tips for Capturing the Perfect Pour","Adobe Lightroom+Creative+Dslr+Food Photography+Lifestyle Photography+Lighting+Photography+Styling"
1654744071,"Vue.js: Build a Full Stack App With Firebase, Vuex & Vue Router","CSS+HTML+Javascript+Technology+Web Design+Web Development"
1655715171,"Digital Art Collaboration: Grow Your Creative Skill Set & Network","Creative+Digital Art+Digital Illustration+Digital Photography+Illustration+Skillshare Original"
1656676097,"101 Guide to Drawing Eyes","Animation+Art+Caricature+Character Design+Comic Art+Creative+Drawing+Illustration"
1656936604,"Think in INK: A 7-Day Analogue and Digital Inking Challenge","Creative+Digital Illustration+Drawing+Illustration+Inks+Inktober+Procreate+Sketching"
1658221492,"Emmet: Write HTML+CSS Like a Ninja","Coding+CSS+HTML+Technology+Web+Web Design+Web Development+Website"
1658337219,"Paint a Feather Forest Pattern in Watercolor and Gold","Creative+Fine Art+Painting+Pattern Design+Surface Pattern Design+Watercolors"
1661615161,"Drawing Collections: Illustrating Stories through Taxonomies","Adobe Photoshop+Creative+Digital Illustration+Drawing+Graphic Design+Illustration+Skillshare Original"
1662138332,"Non-Traditional Branding: Design Your Obsession","Branding+Creative+Graphic Design+Identity Design+Skillshare Original"
1663599873,"Adobe Camera Raw and Lightroom for Lunch™ - Creatively Relight an Image","Adobe Lightroom+Adobe Photoshop+Creative+Digital Photography+Photo Editing+Photo Retouching+Photography"
1663846723,"Find Your Brand Voice: A Brand First Workshop","Advertising+Branding+Business+Content Marketing+Creative Writing+Marketing+Personal Branding+Staff Pick"
1665125736,"Illustrator for Lunch™ - Make Scrapbook Papers to Sell - Patterns, File Formats, Marketing Materials","Adobe Illustrator+Creative+Digital Illustration+Graphic Design+Illustration+Social Media"
1665424548,"Classic Pattern Styles - Learn To Design Damask Patterns","Adobe Illustrator+Creative+Drawing+Graphic Design+Illustration+Pattern Design+Sketching+Surface Pattern Design"
1665547575,"Classic Pattern Styles - Learn To Design Toile de Jouy Patterns","Adobe Illustrator+Creative+Drawing+Graphic Design+Illustration+Pattern Design+Sketching+Surface Pattern Design+Vector"
1668654798,"Procreate Brushes - Exploring Brush Settings On The IPad through 20 Custom Digital Brushes","Creative+Digital Illustration+Graphic Design+Illustration+Ipad+Ipad Art+Procreate+Procreate Brushes"
1669388446,"Adobe Camera Raw and Lightroom for Lunch™ - Lightroom Overview - Is Lightroom for you?","Adobe Camera Raw+Adobe Lightroom+Adobe Photoshop+Creative+Digital Photography+Photo Editing+Photography"
1671553379,"70s Lettering","Calligraphy+Creative+Digital Illustration+Hand Lettering+Handlettering+Illustration+Ipad+Procreate"
1671627151,"Lettering for Self-Expression: Create Stunning, Hand-Crafted Type","Creative+Illustration"
1672157275,"How to Communicate with Clients: Building Relationships that Last","Business+Design Business+Freelance & Entrepreneurship+Graphic Design+Networking+Pricing+Skillshare Original"
1675369624,"Illustrator for Lunch™ - Whimsical Scrapbook Paper Designs to Sell or Share","Adobe Illustrator+Creative+Design Techniques+Digital Illustration+Graphic Design+Scrapbooking+Social Media+Surface Pattern Design+Vector Art"
1675589427,"iPad Art: Watercolor Painting to Digital Seamless Pattern on your iPad","Creative+Design Patterns+Illustration+IOS+Ipad+Mobile Apps+Pattern Design+Pixelmator+Surface Pattern Design"
1678005973,"Illustrator for Lunch™ - Make to Sell Printables - Stripes, Grid, Lines & Isometric Grid","Adobe Illustrator+Creative+Digital Illustration+Graphic Design+Illustration+Social Media"
1678502999,"Learn to Paint a Wedding Bouquet in Watercolor","Creative+Fine Art+Illustration+Painting+Visual Arts+Watercolors+Wedding Bouquet"
1679990509,"watercolor painting en plein air","Creative+Drawing+En Plein Air+Fine Art+Illustration+Painting+Travel+Watercolors"
1682775584,"The Art of Lettering: Intro to Hand-Drawn Script","Calligraphy+Creative+Hand Lettering+Illustration+Lettering+Skillshare Original+Typography"
1682824371,"Isolate the Linework in your Illustrations","Adobe Photoshop+Creative+Design+Digital Illustration+Illustration"
1682830032,"Intro to 3D Lettering in Procreate","Creative+Graphic Design"
1682951027,"Photoshop for Lunch™ - Bend Objects with Puppet Warp","Adobe Photoshop+Compositing+Creative+Design Skills+Digital Illustration+Digital Photography+Graphic Design+Puppet Warp+Visual Design"
1683110453,"Modern Watercolor Techniques: Explore Skills to Create On-Trend Paintings","Adobe Photoshop+Creative+Drawing+Fine Art+Illustration+Painting+Staff Pick+Watercolors"
1684109006,"Simple Steps to More Stunning Mandalas","Art+Creative+Creativity+Drawing+Fine Art+Illustration"
1685259106,"Watercolor, Gouache & Acrylic: Layering and Blending in Different Mediums","Acrylic+Creative+Fine Art+Gouache+Illustration+Painting+Watercolors"
1686186034,"Illustration Practice: Lettering & Florals With Adobe Fresco","Adobe Fresco+Brainstorming+Creative+Digital Illustration+Hand Lettering+Illustration+Rendering+Sketching"
1687007462,"Improve Your Ink Work: Brush Pen Adventures with Lines and Textures","Black And White+Comic Art+Creative+Creativity+Drawing+Illustration+Painting+Student Tools"
1687190031,"Digital Illustration: Doodles to Designs","Adobe Illustrator+Creative+Digital Illustration+Drawing+Graphic Design+Illustration+Poster Design+Skillshare Original"
1687732279,"Painterly Autumn Flowers and Leaves in Watercolor","Creative+Fine Art+Painting+Sketching+Stationery+Watercolor Painting+Watercolors+Wedding"
1688839195,"Ultimate Texturing Techniques for Illustrator","Adobe Illustrator+Creative+Digital Illustration+Graphic Design+Illustration+Vector Art+Vector Graphics"
1692671649,"Source & Mix: Digital Collage from Vintage Encyclopedia Illustrations","Adobe Photoshop+Art+Collage+Creative+Digital Illustration+Graphic Design+Illustration+Poster Design"
1693466572,"Instagram Branding Peekaboo: Artful Branding on Social Media","Branding+Business+Creative+Graphic Design+Illustration+Instagram+Marketing+Social Media Marketing"
1694923864,"Animating With Light","Adobe After Effects+Animation+Creative+Motion Graphics+Typography"
1695188892,"The Perfect Grilled Cheese: A Mini Class to Master the Sandwich | Learn with Plated","Culinary+Food & Drink+Grilled Cheese+Home+Lifestyle+Plated+Skillshare Original"
1695544689,"Design a Digital Planner with Vectors in Affinity Designer","Bullet Journal+Creative+Digital Planner+Digital Planning+Etsy+Graphic Design+Ipad+Vector"
