"sku","title","tags"
995737,"Pattern Design on the iPad - Learn the Basics of  the iOrnament App","Creative+Digital Illustration+Digital Painting+Graphic Design+Illustration+IOrnament+Ipad+Pattern Design"
6243591,"Watercolor and Mixed Media","Anavictoriana+Clouds+Creative+Fine Art+Masking Fluid+Texture+Watercolors"
7283538,"Illustrator for Lunch™ - Create Stitches and Sewing Elements","Adobe Illustrator+Creative+Design Skills+Digital Illustration+Embroidery+Graphic Design+Illustration+Textures"
7441027,"Design a Brand Identity: Write an Airtight Creative Brief","Branding+Communication+Creative+Creative Briefs+Design Thinking+Graphic Design+Identity Design+Visual Communication"
9088320,"Get it Made, Get it Sold: The Basics of Sourcing & Sales for Entrepreneurs","Apparel Sourcing+Business+Manufacturing+Sales+Sales Strategy+Skillshare Original"
9960377,"Smartphone Photography: Capturing Landscapes","Adventure Photography+Creative+Digital Photography+Instagram+Nature Photography+Photography+Skillshare Original"
10189345,"Baugasm™ Series #4 - Design a poster with an Abstract iridescent effect","3D Design+Adobe Photoshop+Animation+Cinema 4D+Color Theory+Creative+Design+Graphic Design"
10567140,"Adobe Illustrator Speed Course: Increase Workflow & Efficiency","Adobe Illustrator+Creative+Graphic Design+Illustration+Typography"
11719991,"How to Paint: Master Watercolor Cacti & Succulents","Creative+Drawing+Illustration+Painting+Watercolors"
13878749,"Baugasm™ Series #1  - Create Experimental Gradients and Posters","Adobe Illustrator+Adobe Photoshop+Creative+Design+Gradient+Graphic Design+Poster"
14731776,"Side Project Success","Business+Design Business+Entrepreneurship+Product Design+Side Project"
15153730,"Face Facts: Beginners Guide to Drawing a Self Portrait","Art+Character Design+Creative+Drawing+Fine Art+Illustration+Portraits+Sketching"
15766467,"Terrazzo Patterns Without Drawing a Shape! - An Illustrator for Lunch™ Class","Adobe Illustrator+Creative+Design Patterns+Design Techniques+Graphic Design+Scrapbooking+Surface Design+Surface Pattern Design+Vector Graphics"
16107545,"Photoshop for Lunch™ - Photo Texture Collage - Gradient Map, Blending & Textures","Adobe Photoshop+Creative+Digital Illustration+Digital Photography+Graphic Design+Illustration+Photo Editing"
18638419,"Javascript Fun: Build a Music Player App!","CSS+CSS3+HTML+HTML5+Javascript+Technology+Web Design+Web Development"
19453402,"Watercolour Greenery: How to Paint Trees","Botanical+Creative+Fine Art+Illustration+Painting+Watercolor+Watercolor Painting+Watercolors"
19656262,"Illustrator for Lunch™ - 5 Cool Text Effects","Adobe Illustrator+Creative+Design Techniques+Digital Illustration+Graphic Design+Lettering+Text Effects+Typography+Vector Art"
20145622,"Digital 80s Design: Combining Illustrator and Photoshop","3D Design+Adobe Illustrator+Adobe Photoshop+Creative+Graphic Design+Skillshare Original+Typography+Visual Effects"
21928491,"Fundamentals of Photoshop: Drawing, Layers, Masks, and Selections (Photoshop II)","Adobe Photoshop+Creative+Graphic Design+Skillshare Original"
21997211,"Winter Color Trends 2019/2020 - Learn to Mix Beautiful Color Schemes","Color+Color Theory+Creative+Illustration+Painting+Trends+Watercolor Painting+Watercolors"
22284335,"STICKER SHOCK! Create an iMessage sticker pack","Adobe Illustrator+Animation+Creative+Graphic Design+Illustration+IPhone+Mobile Development+Stickers"
24551514,"Cartooning: Drawing Bodies and Poses","Character Design+Comic+Comic Art+Comics+Concept Art+Creative+Illustration+Webcomics"
25246843,"How to Draw the Head from Every Angle: Part One","Art+Caricature+Character Animation+Character Design+Creative+Drawing+Illustration"
26484265,"Illustrator for Lunch™ - Backgrounds for your projects - Sunbursts, Halftone, Blends & Brushes","Adobe Illustrator+Creative+Design Skills+Digital Illustration+Graphic Design+Illustration+Logo Design+Surface Pattern Design"
29608040,"Fun Watercolour Techniques: How to Paint Ice Lollies","Art+Creative+Fine Art+Illustration+Painting+Watercolors"
30291311,"Procreate Practice: Creating and Illustrating With Texture Overlays","Creative+Digital Illustration+Illustration+Ipad+Procreate+Texture Overlays+Textures"
30685309,"Posters with LeDoux: Draw a 3-Color Poster for Your Favorite Band","Creative+Drawing+Illustration+Posters+Screenprinting"
30704719,"Illustrator for Lunch™ - 3D Perspective Cube design and Bonus 3D star.","3D Design+Adobe Illustrator+Creative+Design Skills+Design Techniques+Digital Illustration+Graphic Design+Illustration+Surface Design"
31359229,"Writing For Consistency: Finding Your Creative Voice | Learn with Wattpad","Creative+Creative Writing+Fiction+Marketing+Skillshare Original+Wattpad+Writing+Writing & Publishing"
31871267,"Getting a YES: How to Prep, Pitch, Persuade, and Close","Business+Entrepreneurship+Leadership+Pitching+Sales+Skillshare Original+Storytelling"
33983003,"Illustrator for Lunch™ - Something's Fishy - Appearance Panel Tips & Tricks","Adobe Illustrator+Creative+Digital Illustration+Graphic Design+Illustration+Vector"
34882377,"Illustration for Designers: Create Your Own Geometric Animal","Adobe Illustrator+Creative+Digital Illustration+Graphic Design+Icon Design+Illustration+Skillshare Original"
35046322,"Full Stack Web Development for Beginners- Part 4: Final Project, Node, Express & MongoDB","Express+Javascript+Mongodb+Node.Js+Technology+Web Development"
36758950,"Fundamentals of Manga: Digital Illustration","Character Design+Concept Art+Creative+Digital Illustration+Illustration+Skillshare Original"
37868876,"Illustrator for Lunch™ - Cute Furry Creatures","Adobe Illustrator+Creative+Design Skills+Digital Illustration+Flat Design+Graphic Design+Illustration+T-Shirt Design+Vector Art"
38905190,"Paint From Your Sofa: Realistic Food Illustration in a Comfy Setting","Colored Pencils+Creative+Drawing+Food Illustration+Illustration+Painting+Watercolor Painting+Watercolors"
38927263,"Presentations: Slide Deck Design for Non-Designers","Business+Business Development+Entrepreneurship+Information Design+Marketing+Skillshare Original"
40939085,"Sketchbook Illustration: Draw a Personal, Colorful Travel Map","Creative+Illustration+Journaling+Sketchbook+Sketching+Skillshare Original+Travel"
44185260,"Styling Food for Instagram: Creating Collages to Photograph","Creative+Digital Photography+Food & Drink+Instagram+Lifestyle Photography+Photography+Skillshare Original"
45513786,"Design a Brand Identity: Ask the Right Questions","Branding+Communication+Creative+Design Thinking+Forms+Graphic Design+Identity Design+Typeform+Visual Communication"
45653456,"Thumbnail Sketching: A Magically Simple Way to Improve Your Work","Art+Concept Design+Creative+DIY+Drawing+Fine Art+Illustration+Sketching"
46687130,"Repeating Patterns in After Effects","Adobe After Effects+Animation+Creative+Graphic Design+Motion Graphics+Pattern Design"
46846089,"Mixed Media For Beginners: Combining Colored Pencil and Gouache","Adobe Illustrator+Colored Pencils+Creative+Fine Art+Illustration+Painting+Sketching+Watercolors"
47254110,"The Golden Secrets of Hand-Lettering: Create the Perfect Postcard","Creative+Hand Lettering+Illustration+Lettering+Logo Design+Typography"
49499074,"Cinematography Course | Shoot Expert Video on Any Camera","Camera+Cinematography+Creative+Film Production+Filmmaking+Lighting+Video Production+Videography"
49970884,"Photoshop for Lunch™ - Create HUD Rings - Repeat Transform, Filters & Textures","Adobe Photoshop+Art+Creative+Design Techniques+Digital Illustration+Graphic Design+Illustration+Visual Effects"
50017274,"Inspired Fashion Design: Sketching Collections","Conceptual Design+Creative+Fashion Design+Graphic Design+Sketching+Skillshare Original+Trend & Color Research"
50393913,"How to Create Watercolor Figures on Your iPad in Procreate + FREE Digital Watercolor Brushes","Creative+Fashion Illustration+Figure Drawing+Fine Art+Illustration+Ipad+Portraits+Procreate+Watercolors"
50476536,"Teacher Tips: Designing A Successful Skillshare Class","Business Skills+Entrepreneurship+Freelance & Entrepreneurship+Lifestyle+Skillshare+Teaching"
52409119,"DIY Green Screen for Film: Creating Surreal Visual Effects","Adobe After Effects+Animation+Creative+Film Editing+Filmmaking+Green Screen+Skillshare Original"
52764309,"Watercolor Giraffe","Creative+Fine Art+Giraffe Painting+Illustration+Painting+Watercolor How To+Watercolors+Wildlife Art"
53175001,"Remove the Background from Any Illustration Using Pixelmator","Creative+Digital Editing+Editing+Illustration+Pixelmator+Remove Background+Retouching+Scanning"
53265064,"Photo Editing in Lightroom: Make Your Cityscapes Stand Out","Adobe Lightroom+Creative+Digital Photography+Photo Editing+Photographic Composition+Photography+Skillshare Original+Street Photography"
53825608,"Learn Adobe After Effects CC for Beginners","Adobe After Effects+After Effects+Animation+Beginner+Creative+Film & Video+Film Production+Visual Effects"
53905075,"Filmmaking From Home: Turn Found Footage into a Compelling Video","Adobe Premiere+Creative+Documentaries+Documentary+Film & Video+Skillshare Original+Video+Video Editing+Visual Storytelling"
54448763,"Timelapse Photography II: The Art of Hyperlapse","Adobe After Effects+Animation+Creative+Digital Photography+Photo Editing+Photography+Skillshare Original+Street Photography"
54511951,"Easy Instant Coffee Painting! Fun Techniques & Mini Illustrations","Art+Creative+Creativity+DIY+Drawing+Fine Art+Illustration+Painting"
54528520,"Branding for Entrepreneurs: Building an Aspirational Brand in the Instagram Era","Branding+Business+Digital Strategy+Instagram+Instagram Marketing+Marketing+Personal Branding+Skillshare Original"
54958115,"Teach Yourself to Draw Anything: A Step-by-Step Process","Art+Creative+Drawing+Fine Art+Illustration+Sketching+Staff Pick+Visual Arts"
57100566,"DSLR Camera Essentials: Film & Edit Stunning Timelapse Videos","Creative+Dslr+Film Editing+Film Production+Filmmaking+Skillshare Original+Street Photography+Timelapse"
58374499,"Illustrator for Lunch™ - Stylish Doodles to Make and Sell","Adobe Illustrator+Branding+Creative+Design Skills+Design Techniques+Digital Illustration+Flat Design+Graphic Design+Vector Art"
58705501,"The Art of Timelapse and Hyperlapse Photography","Adobe Lightroom+Creative+Digital Photography+Photo Editing+Photographic Composition+Photography+Skillshare Original"
59637006,"Find Your Photography Style: Create Consistent Photos","Adobe Lightroom+Creative+Digital Photography+Instagram+Lighting+Photo Editing+Photography+Style+Styling"
59747654,"Lettering a Monoline Wordmark: Creating Graffiti-Inspired Uniform Lines","Adobe Photoshop+Calligraphy+Creative+Graphic Design+Hand Lettering+Illustration+Lettering+Skillshare Original"
60394778,"Shopify Theme Programming: Liquid, JSON and Javascript","CSS+HTML+HTML5+Javascript+Programming+Shopify+Shopify Liquid+Technology+Web Development"
61262057,"Source & Mix: Surface Patterns from Vintage Encyclopedia Illustrations","Adobe Photoshop+Creative+Digital Illustration+Graphic Design+Illustration+Pattern Design+Surface Pattern Design"
62903648,"Cityscape Photography: Capture Your City's Story","Adobe Lightroom+Creative+Digital Photography+Dslr+Photography+Skillshare Original+Street Photography"
62941461,"Dot Pattern: Smart Texturing In Photoshop","Adobe Photoshop+Creative+Design+Graphic Design+Hand Lettering+Illustration+Textures+Typography"
65114706,"ABCDecisions™: The Science of Winning Decisions","Business+Leadership+Performance+Productivity"
66826731,"Baugasm™ Series #10 - Design 3 Different Abstract Posters in Adobe Photoshop and Illustrator","Adobe Photoshop+Creative+Graphic Design+Poster"
68887879,"Music Theory: Exploring Sound, Rhythm, and Melody on the MIDI Grid","Creative+Ear Training+Music Composition+Music Fundamentals+Music Production+Music Theory+Skillshare Original"
69026419,"Jump Start a Daily Art Practice","Art+Creative+Creativity+Drawing+Illustration+Painting+Sketching+Watercolors"
70513627,"Hand Lettering - Turning Words Into Art","Art+Crafts+Creative+Drawing+Fine Art+Illustration+Lettering"
70715713,"iPad Art: Get to Know Graphic - Learn Vector Basics & Make a Greetings Card","Creative+Digital Illustration+Graphic App+Graphic Design+Illustration+Ipad+Vector+Vector Art+Vector Graphics"
71642903,"Learn to Fearlessly Mix and Use Color for Watercolor Painting","Art+Color+Color Theory+Creative+Illustration+Painting+Sketchbook+Watercolors"
75720407,"Adobe Camera Raw and Lightroom for Lunch™ - Mastering Printing - Create a Triptych","Adobe Camera Raw+Adobe Lightroom+Adobe Photoshop+Creative+Digital Photography+Photo Editing+Photography"
77299146,"Email Marketing Essentials: Designing Effective Emails","Business+Email Marketing+Entrepreneurship+MailChimp+Marketing+Skillshare Original"
77652048,"Dynamic Mark Making / Drawing with Expression & Creativity","Art+Creative+Creativity+Creativity & Innovation+Drawing+Fine Art+Illustration+Sketching"
78310865,"CSS Essentials: Getting Started with CSS Grid","CSS+CSS GRID+Layout Design+Skillshare Original+Technology+Web Design+Web Development"
78317650,"Wedding Watercolor Sketching","Cake Decorating+Creative+Design Thinking+Drawing+Illustration+Sketching+Watercolors+Wedding Event"
78392034,"Blog Content Basics: Content Ideas to Increase Your Reach","Blogging+Content Marketing+Content Strategy+Creative+Digital Strategy+Google+Search Engine Optimization+SEO+Writing"
80375085,"Color Workshop: The Basics for Artists and Illustrators","Color+Crafts+Creative+Design Techniques+Digital Illustration+Drawing+Fine Art+Illustration+Lifestyle"
82035021,"Watercolor Magic: Mixed Media & Experimental Techniques","Art+Creative+Creativity+DIY+Fine Art+Illustration+Painting+Watercolors"
83912273,"Choose Must: 10 Hands-On Exercises to Find and Pursue Your Passion","Creative+Creativity+Creativity & Innovation+Entrepreneurship+Fine Art+Graphic Design+Self-Improvement+Skillshare Original"
83942744,"How To Brand Your Business","Branding+Business+Digital Marketing+Leadership+Marketing+Personal Branding+Social Media Marketing+Staff Pick"
84030568,"Data Visualization: Customizing Charts for Beauty & Impact","Creative+Data Analysis+Data Visualization+Graphic Design+Information Design+Skillshare Original+Web Design"
86773398,"Inking in Adobe Illustrator","Adobe Illustrator+Creative+Design+Digital Illustration+Doodle Art+Drawing+Illustration+Inking"
88669495,"Street Photography: Capture the Life of Your City","Adobe Lightroom+Creative+Dslr+Mobile Photography+Photography+Skillshare Original+Street Photography"
89094433,"Shading / Learn to Draw the Figure in Dramatic Light & Shadow","Creative+Creativity+Drawing+Figure Drawing+Fine Art+Illustration+Sketching"
89634830,"iPad Art: An Introduction to Vectornator - Create a Cactus Pattern","Creative+Digital Illustration+Illustration+Ipad+Surface Pattern Design+Vector Art+Vector Graphics+Vectornator"
90804207,"Brand Identity Design: How to Design Brands People Care About","Branding+Creative+Graphic Design+Identity Design+Logo Design+Skillshare Original"
91727253,"Create A Retro Delorean Loop in Cinema 4D and After Effects","3D Animation+Adobe After Effects+After Effects+Animation+Cinema 4D+Creative+Motion Graphics+Premiere Pro"
92531535,"Circular Logo Design with Draplin: Combine Type & Icons in a Classic Shape","Adobe Illustrator+Creative+Graphic Design+Logo Design+Skillshare Original"
94096628,"Watercolor Textures","Creative+Fine Art+Modern+Texture+Watercolors"
94758831,"Photoshop for Lunch™ - Complex Pattern Swatches","Adobe Photoshop+Creative+Digital Illustration+Graphic Design+Illustration+Pattern Design"
94826414,"Speed Up & Streamline Your Design Workflow in Adobe Illustrator","Adobe Illustrator+Creative+Graphic Design+Illustration+Pattern Design+Productivity+Surface Pattern Design+Workflow"
94850115,"Get Inked! Create a Custom Manufactured Rubber Stamp","Craft+Crafts+Creative+Graphic Design+Hand Lettering+Illustration+Lifestyle+Rubber Stamp+Stationery"
97063549,"T-Shirt Design Workshop 02: Using Photoshop, Illustrator, and Hand-Drawing Techniques","Creative+Graphic Design+Hand Lettering+Illustration+T-Shirt Design+Vector Graphics"
97378765,"Take the Creative Leap! Overcoming Fear of Failure","Business Skills+Calligraphy+Creative+Creativity+Design Skills+Fine Art+Illustration+Painting"
97493108,"Watch Me Shoot: How to Capture Bright and Airy Pancakes","Adobe Lightroom+Creative+Digital Photography+Lifestyle Photography+Lighting+Photographic Composition+Photography+Photoshoot+Styling"
99410767,"The Ultimate Guide to 3D in After Effects","3D+3D Animation+Adobe After Effects+After Effects+Animation+Cinema 4D+Creative+Motion Graphics"
99917311,"Picture Books II: Illustrate a Story","Adobe Photoshop+Art+Character Design+Creative+Digital Illustration+Illustration+Publishing+Writing & Publishing"
100488808,"Adobe Lightroom - Finding Your Unique Editing Style","Adobe Lightroom+Creative+Editing+Editing Style+Photo Editing+Photo Retouching+Photography+Post Production+Travel Photography"
101309737,"Context is Key: Social Media Strategy in a Noisy Online World","Business+Content Strategy+Digital Strategy+Entrepreneurship+Marketing+Skillshare Original+Social Media"
101522117,"Learn to Use Canva: The Easy, Effective Design Solution for Non-Designers","Business Development+Creative+Entrepreneurship+Graphic Design+Marketing+Skillshare Original+Web Design"
101537411,"Explore Adobe Fresco: Paint with Vector, Pixel and Live Brushes","Adobe Fresco+Creative+Digital Illustration+Digital Painting+Illustration+Ipad+Vector Art"
104202823,"Creative Writing Bootcamp: Start a Brand New Story","Creative+Creative Writing+Creativity+Fiction+Skillshare Original+Storytelling"
107192571,"Food Photography: Shooting at Restaurants","Creative+Digital Photography+Dslr+Food & Drink+Food Photography+Instagram+Photography+Skillshare Original"
109014891,"Watercolor Winter Illustrations","Character Design+Creative+Creative Insights+Creativity+Fine Art+Illustration+Painting+Watercolors"
109204668,"Digital Illustration on the iPad: A Can Of Worms","Character Design+Creative+Digital Illustration+Figure Drawing+Illustration+Ipad+Procreate"
109834927,"Magical Patterns: Simple Watercolors and Pencil Drawing","Adobe Photoshop+Creative+Drawing+Fine Art+Flowers+Illustration+Pattern Design+Watercolors"
111033882,"Focus to Flourish: Productivity Skills for the Creative","Business+Content Strategy+Design Business+Entrepreneurship+Mastering+Productivity+Surface Pattern Design+Time Management+Work From Home"
111225214,"Watercolor Gems & Jewelry","Creative+Illustration+Painting+Watercolors"
112402133,"Illustrating Patterns: Creating Hand-Drawn Wallpaper","Creative+Drawing+Graphic Design+Illustration+Pattern Design+Skillshare Original+Surface Design"
113053678,"Confidence for Creatives: replacing imposter syndrome and self doubt with gratitude and compassion","Confidence,+Creative+Illustration"
114188688,"Acrylic Landscapes on the iPad in Procreate","Acrylic Painting+Creative+Digital Illustration+Digital Painting+Fine Art+Ipad+Landscape+Painting+Procreate"
116014062,"Being a Travel Blogger (Even When You're Not Traveling!)","Blogging+Creative+Journalism+Travel+Writing+Writing & Publishing"
118069731,"Adobe Illustrator: Make Paths Fast & Easy","Adobe Illustrator+Art+Creative+Digital Illustration+Graphic Design+Illustration+Vector"
118753989,"Watercolor: Paint a Beautiful, Realistic Galaxy","Art+Concept Art+Creative+Fine Art+Galaxy+Illustration+Lighting+Painting+Paper+Watercolors"
119743119,"Custom Bridal: Design The Perfect Gown For You","Bridal+Creative+Fashion Design+Graphic Design+Inspiration Boards+Skillshare Original"
120510425,"Why We Letter: Designing with Friends of Type","Adobe Photoshop+Calligraphy+Creative+Graphic Design+Illustration+Lettering+Skillshare Original+Typography"
121315983,"Blog with love and rank high in Google","Blogging+Business+Content Strategy+Manifesting+Marketing+Online Business+Online Marketing+Search Engine Marketing+SEO"
121692420,"E-Commerce Essentials: How to Start a Successful Online Business","Business+Content Strategy+Ecommerce+Entrepreneurship+Freelance & Entrepreneurship+Marketing+Skilshare Original+Small Business"
123497179,"Create a Dense, Floral, Half Drop Pattern in Procreate","Creative+Digital Illustration+Illustration+Ipad+Pattern Design+Procreate+Surface Pattern Design"
125170367,"Colouring With Markers: Create Contrast & Shade","Architecture+Comic+Creative+Drawing+Fashion Illustration+Fine Art+Illustration+Manga+Markers"
125446153,"Mastering Duotones in Photoshop","Adobe Photoshop+Art+Color+Creative+Digital Illustration+Digital Photography+Graphic Design+Illustration"
125855389,"The Art of Monotype: Create your First Unique Artwork in Minutes with Watercolors or Gouache","Creative+Drawing+Fine Art+Gouache+Illustration+Painting+Printmaking+Watercolors"
126331648,"Brand an Online Shop: Create a Cohesive Product Line","Branding+Business+Creative+Entrepreneurship+Marketing+Product Design+Skillshare Original+UI/UX Design"
126953038,"Create an Intricate, Editable Floral Pattern in Procreate","Creative+Digital Illustration+Illustration+Ipad+Pattern Design+Procreate+Surface Pattern Design"
127213534,"Adventure Photography: Capturing In-Between Moments","Adventure Photography+Creative+Digital Photography+Editorial Photography+Nature Photography+Photographic Composition+Photography+Skillshare Original"
127877979,"Lightroom for Lunch™ - Frame Photos on Export - Presets, Identity Plate, Print Module","Adobe Lightroom+Adobe Photoshop+Creative+Digital Photography+Photo Retouching+Photography+Post Production+Social Media"
130559889,"Baugasm™ Series #9 - Design 3 Different Abstract Posters in Adobe Photoshop and Illustrator","Adobe Illustrator+Adobe Photoshop+Color Theory+Creative+Graphic Design+Ideation+Layout Design+Print Design"
131695124,"Leveling Up Your Art Game: The Elements & Principles of Design","Color+Color Theory+Creative+Illustration+Staff Pick+Visual Arts+Visual Communication+Visual Storytelling"
132530660,"Learn to Paint Watercolor Leaves","Art+Botanical Illustration+Color+Creative+Painting+Sketching+Watercolors"
133254127,"Scientific Illustration: Conveying Information with Charm","Adobe Photoshop+Art+Creative+Digital Illustration+Graphic Design+Illustration+Lettering"
133293390,"Getting Started with Email Marketing | Learn with Mailchimp","Business+Content Marketing+Email Marketing+Entrepreneurship+MailChimp+Marketing+Skillshare Original"
133378273,"Adobe Illustrator CC – Advanced Training","Adobe Illustrator+Creative+Flat Design+Graphic Design+Layout Design+Print Design+Visual Design+Web Graphics"
134387458,"How to Efficiently Build Wordpress Websites with Divi","CSS+Divi+HTML5+MySQL+Php+Technology+Web Development+WordPress"
134966819,"How to Flourish: Adding \"Oomph\" to Your Calligraphy","Brush Lettering+Calligraphy+Creative+Flourishing+Hand Lettering+Handwriting+Illustration+Modern Calligraphy+Script"
137528060,"Illustrator Nuggets For Surface Designers","Adobe Illustrator+Creative+Digital Illustration+Floral+Graphic Design+Illustration+Surface Design+Surface Pattern Design"
137810930,"Art School Boot Camp: Expanding Your Style with Art History","Art+Art History+Creative+Drawing+Fine Art+Illustration+Painting"
140886095,"Lettering for Brands: Working with Clients to Create Iconic Designs","Creative+Freelance & Entrepreneurship+Graphic Design+Identity Design+Lettering+Skillshare Original+Typography+Visual Storytelling"
141080715,"How to get the Ombre Effect with a Brush Pen | Brush Lettering | How to do Ombre Lettering","Brush Lettering+Calligraphy+Creative+Drawing+Hand Lettering+Handwriting+Illustration+Lettering"
141575474,"Everyday Surrealism: Using Apps to Create Photo Art","Creative+Digital Photography+Instagram+Mobile Apps+Photo Editing+Photographic Composition+Photography+Skillshare Original"
141834802,"Digital Illustration: Streamlining with Adobe Tools","Adobe Illustrator+Adobe Photoshop+Adobe Sketch+Creative+Graphic Design+Illustration+Skillshare Original"
144789829,"Photoshop CC 2020 Productivity Techniques","Adobe Photoshop+Creative+Design Projects+Digital Art+Graphic Design+Photo Retouching+Print Design+Productivity+Retouching"
145629020,"Demystifying Cryptocurrency: Understanding Bitcoin and Beyond","Bitcoin+Business+Coinshares+Cryptocurrency+Economics+Finance+Investing+Skillshare Original"
146297737,"Watercolor Birds","Adobe Photoshop+Birds+Creative+Design Thinking+Fine Art+Illustration+Painting+Surface Design+Watercolors"
146443114,"Learn to Paint Watercolor Orchids","Art+Creative+Fine Art+Illustration+Painting+Sketching+Visual Arts+Watercolors"
147221070,"Illustrator for Lunch™ - 20 Gradient tips in 20 minutes","Adobe Illustrator+Creative+Design Skills+Design Techniques+Digital Illustration+Drawing+Gradient+Graphic Design+Vector Art"
148464938,"Writing for Online Engagement: Fiction in a Digital World","Creative+Creative Writing+Fiction+Marketing+Skillshare Original+Wattpad+Writing+Writing & Publishing"
148727063,"Doodle Art: Basics and Beyond","Art+Creative+Creativity+DIY+Doodling+Drawing+Fine Art"
148739011,"Classic Illustration - Drawing The Acanthus","Creative+Design Projects+Drawing+Illustration+Lettering+Pattern Design+Print Design+Wedding"
151296615,"Gesture / An Introduction to the Art of Figure Drawing","Creative+Drawing+Figure Drawing+Fine Art+Illustration+Sketching"
151973892,"Cyanotypes: Introduction to Botanical Art Prints - Create Ready to Hang Art","Art+Creative+Cyanotype+Fine Art+Nature Photography+Print Design+Printmaking+Visual Arts"
152440843,"Color on the Web II: Design for Clarity and Compliance","Color Theory+Creative+Digital Illustration+Skillshare Original+UI/UX Design+Web Design"
