"sku","title","tags"
617508069,"Illustrator for Lunch™ - 10 Layer Tips in 10 minutes","Adobe Illustrator+Creative+Design Skills+Digital Illustration+Graphic Design+Illustration+Surface Pattern Design"
618227090,"From Abstract Handmade Marks on Paper to Seamless Surface Patterns in Illustrator","Adobe Illustrator+Adobe Photoshop+Creative+Design Techniques+Graphic Design+Pattern Design+Print Design+Surface Pattern Design"
619628161,"Video Editing: Transforming Footage into Evocative Travel Stories","Color Grading+Creative+Film & Video+Post Production+Skillshare Original+Travel+Video Editing+Video Production"
620687254,"Create Compelling Products: Make Calendars with Your Art in Photoshop","Adobe Photoshop+Art+Calendars+Creative+Graphic Design+Illustration+Print Design+Product Design"
621192110,"Watercolor Hand Lettering on Your iPad in Procreate + Free Brushes and Paper Texture","Creative+Digital Painting+Graphic Design+Hand Lettering+Handwriting+Ipad+Lettering+Procreate+Watercolors"
621973088,"Wildlife Photography: Capturing Portraits of Your Favorite Animals","Creative+Digital Photography+Nature Photography+Outdoor Photography+Photography+Skillshare Original+Wildlife Photography"
622706913,"STICKERS: Design, Setup, Slap","Adobe Illustrator+Creative+Digital Illustration+Drawing+Graphic Design+Illustration"
623064881,"Movement: Capturing Adventure-Filled Portraits","Adobe Lightroom+Creative+Dslr+IPhone+Movement+Photography+Portrait Photography+Portraits+Visual Storytelling"
623367817,"Paint a Portrait in Photoshop: Blank Canvas to Finished Illustration","Adobe Photoshop+Creative+Digital Illustration+Digital Painting+Drawing+Graphic Design+Illustration+Painting+Sketching"
624135598,"Painting a Peony in Watercolor : in three styles","Color+Creative+Drawing+Fine Art+Painting+Sketching+Surface Design+Watercolors"
624655764,"Photojournalism: Making Photo Essays and Stories","Creative+Digital Photography+Editorial Photography+Photography+Portrait Photography+Skillshare Original+Street Photography"
625650159,"How to Sketch Like an Industrial Designer","Creative+Drawing+Industrial Design+Invention+Product Design+Quirky+Skillshare Original+UI/UX Design"
626894710,"painting watercolor agates & geodes | mini beginner class","Art+Creative+Fine Art+Illustration+Painting+Visual Arts+Watercolors"
627716916,"Watercolor Lettering","Calligraphy+Creative+Hand Lettering+Illustration+Lettering+Painting+Watercolors"
628550577,"Label Design: Make Your Packaging Fizz","Adobe Illustrator+Branding+Creative+Digital Illustration+Graphic Design+Illustration+Skillshare Original"
629481794,"Photoshop for Lunch™ - Create Mockups to Use and Sell - Blends, Smart Objects, Effects","Adobe Photoshop+Creative+Digital Illustration+Graphic Design+Illustration+Social Media"
630709591,"Art of Growth: Sustainably Scale Your Business","Business+Business Development+Entrepreneurship+Marketing+Skillshare Original"
632285522,"Painting Watercolor Dahlias in 3 styles","Botanical Art+Creative+Creativity+Fine Art+Illustration+Painting+Sketchbook+Sketching+Watercolors"
636665256,"Illustrator for Lunch™ - One Design Concept - Many Variations","Adobe Illustrator+Creative+Digital Illustration+Graphic Design+Illustration+Surface Pattern Design"
637056424,"Photoshop for Lunch™ - Vintage Image Cutout Effect - Selections, Drop Shadows, Transparency","Adobe Photoshop+Creative+Digital Illustration+Digital Photography+Graphic Design+Illustration"
637069326,"Watercolor: Basic Techniques","Creative+Design+Painting+Watercolor+Watercolors"
637385311,"Basic Skills / Getting Started with Drawing","Art+Creative+Creativity+Drawing+Fine Art+Graphic Design+Illustration+Sketching"
637661219,"Personal Branding: Crafting Your Social Media Presence","Branding+Business+Entrepreneurship+Marketing+Skillshare Original+Social Media+Social Media Marketing+Wit & Delight"
637805026,"Classic Pattern Styles: Learn to Design Arts and Crafts Patterns - Part 1","Adobe Illustrator+Art+Craft+Creative+Drawing+Illustration+Pattern Design+Surface Pattern Design"
639566291,"Acrylic Painting: Explore A New Composition Using A Reference Photo","Acrylic+Acrylic Painting+Art+Creative+Fine Art+Oil Painting+Painting+Watercolors"
640233088,"Intro to Digital Painting: Procreate to Photoshop! A Beginner-Friendly Guide","Adobe Photoshop+Color+Creative+Digital Painting+Drawing+Illustration+Procreate"
640346588,"Launch A Rocket: Learn JavaScript Basics The Fun Way!","Technology+UI/UX Design+Web Design+Web Development"
642302846,"Portraits and Places: Photographing People in Their Spaces","Creative+Digital Photography+Instagram+Lifestyle Photography+Nature Photography+Photography+Portrait Photography+Skillshare Original"
643002283,"Drawing Dreams: Quick Illustrations to Find Your Passion","Creative+Drawing+Graphic Design+Skillshare Original+Spirituality"
643556050,"Create Paper Cuttings on Your iPad in Procreate + Digital, Hand Cut, and Cricut Machine Cutting","Creative+Cricut+Digital Illustration+Graphic Design+Hand Lettering+Illustration+Ipad+Lettering+Paper"
643926381,"Perspective in Photography: One Beach, Four Styles","Adventure Photography+Creative+Digital Photography+Instagram+Lifestyle Photography+Nature Photography+Photography+Skillshare Original"
647288210,"Create Elegant Place Cards Using Watercolor and Gold Flakes","Calligraphy+Creative+DIY+Fine Art+Lettering+Paper+Watercolors+Wedding+Wedding Event"
648731507,"Illustrator for Lunch™ - Houndstooth & Rose - Vector Halftone Tracing & Houndstooth Pattern","Adobe Illustrator+Creative+Digital Illustration+Illustration"
649129835,"Visual Storytelling: Creating More Persuasive Presentations","Business+Entrepreneurship+Presentation Design+Presentations+Skillshare Original+Storytelling+Visual Communication+Visual Storytelling"
649632732,"Paint with Me: Create a Mixed Media Pastry Illustration","Art+Creative+Fine Art+Illustration+Mixed Media+Painting+Staff Pick+Watercolors"
651583678,"Indie Filmmaking: Get the Blockbuster Look on a DIY Budget","Creative+Film Direction+Film Production+Filmmaking+Skillshare Original+Video Editing+Visual Effects"
657124610,"Reinvent Yourself in the Age of Creativity, Innovation, and Entrepreneurship","Business Development+Entrepreneurship+Lifestyle+Other+Personal Branding+Skillshare Original"
657722127,"Master the Basics of Adobe Illustrator to Create Awesome Illustrations","Adobe Illustrator+Creative+Digital Illustration+Graphic Design+Illustration+Skillshare Original"
658169433,"Photography Basics: Becoming a Professional Instagrammer","Adobe Lightroom+Creative+Digital Photography+Instagram+Photographic Composition+Photography+Skillshare Original+Street Photography"
658216834,"Intro to UX: Designing with a User-Centered Approach","Creative+Design Research+Design Thinking+Skillshare Original+UI Design+UI/UX Design+User Experience+UX Design"
660515165,"Color: A comprehensive course about creating color palettes & Illustrator’s Recolor Artwork Tool","Adobe Illustrator+Color+Color Theory+Creative+Design Patterns+Illustration+Pattern Design+Vector"
660715549,"Hand Lettering Techniques: 5 Ways to Better Work","Adobe Photoshop+Creative+Digital Illustration+Hand Lettering+Illustration+Lettering+Skillshare Original"
663702995,"Vector Illustration: Designing with Texture in Adobe Illustrator","Adobe Illustrator+Creative+Digital Illustration+Graphic Design+Illustration+Skillshare Original+Textures+Vector Graphics"
663897497,"Build a Better Font: An In-Depth Guide To Creating Fonts","Adobe Illustrator+Creative+Font Design+Graphic Design+Hand Lettering+Staff Pick+Typography+Vector"
664347203,"Chalk Lettering in Photoshop","Adobe Photoshop+Creative+Design+Graphic Design+Hand Lettering+Illustration+Lettering+Typography"
667043095,"Design as Strategy: Talking About Design","Branding+Creative+Design Strategy+Design Thinking+Graphic Design+User Experience"
670269678,"Illustrator for Lunch™ - Create Diamond, Harlequin and Argyle Patterns","Adobe Illustrator+Creative+Digital Illustration+Graphic Design+Illustration+Pattern Design"
670292449,"Repurposing Your Artwork: Saving the Earth One Project at a Time","Creative+Design Thinking+Fine Art+Recycling+Visual Arts+Watercolors"
672464254,"Making Humans with Humaaans - A fun way to make people illustrations to use anywhere!","Creative+Flat Design+Graphic Design+Infographics+Portraits+Social Media+Vector Graphics+Web Graphics"
673876746,"Illustrator for Lunch™ - 20 Pathfinder, Crop and Cutout tips in 20 minutes or less","Adobe Illustrator+Creative+Design Skills+Digital Illustration+Drawing+Graphic Design+Illustration+Surface Design+Vector Graphics"
676159570,"Presentations: Nailing Delivery Every Time","Business+Business Development+Content Marketing+Entrepreneurship+Leadership+Marketing+Personal Branding+Skillshare Original"
676223413,"Introduction to GraphQL with Prisma","Database+GraphQL+Node.Js+Technology+Web Development"
677041528,"Type as Image: Draw and Hand-Letter Your Favourite Animal","Adobe Photoshop+Creative+Graphic Design+Hand Lettering+Illustration+Lettering+Typography"
678427985,"Pattern Design: From Straight to Wonky Lines With Adobe Illustrator & Fresco","Adobe Fresco+Adobe Illustrator+Creative+Illustration+Pattern Design+Surface Design+Surface Pattern Design+Wonky Lines"
678578570,"Character Animation: Creating Authentic Facial Expressions in Adobe After Effects","Adobe After Effects+Adobe Illustrator+Animation+Character Animation+Character Design+Creative+Joysticks N' Sliders+Skillshare Original"
679669885,"A Fun Game to Spark Creativity: Play, Break Rules, Make Art","Creative+Creativity+Drawing+Fine Art+Inquiry-Based Learning+Painting+Sketchbook+Watercolor Painting"
681263710,"Rock Out with Character Animation!","Adobe After Effects+Animation+Character Animation+Creative+Motion Graphics"
681411183,"The Art of Ceramics: Creating a Modern Mug","Ceramics+Crafts+Creative+Lifestyle+Pottery+Product Design+Skillshare Original"
681600915,"Introduction to SEO: Tactics and Strategy for Entrepreneurs","Business+Business Development+Content Marketing+Digital Strategy+Entrepreneurship+Marketing+SEO+Skillshare Original"
681952082,"Gouache for Illustrators - 3 different styles","Creative+Gouache+Illustration+Painting+Surface Design"
682839170,"Directing 101: Making a 5 Shot Film","Acting+Cinematography+Creative+Directing+Film & Video+Filmmaking+Videography"
683637231,"Logo Design with Grids: Timeless Style from Simple Shapes","Adobe Illustrator+Branding+Creative+Graphic Design+Illustration+Logo Design+Skillshare Original"
683789185,"Create Fonts on Your iPad in iFont in a Few Easy Steps + 3 Free Fonts","Creative+Graphic Design+Hand Lettering+Handwriting+Ipad+Lettering+Procreate+Web Fonts"
686141220,"Brand Yourself - A Quick Guide on Brand Positioning","Brand Positioning+Brand Strategy+Branding+Business+Design Sprint+Entrepreneurship+Marketing+Personal Branding"
689953448,"Sketchbook Practice : Loose and Lively Watercolor Drinks","Creative+Fine Art+Illustration+Journaling+Painting+Sketch+Sketchbook+Surface Design+Watercolors"
690933742,"Storytelling 101: Character, Conflict, Context & Craft","Creative+Creative Writing+Fiction+Short Stories+Skillshare Original+Storytelling+Writing+Writing & Publishing"
692235023,"Designing for a Global Audience: How to Create Visuals that Work Around the World","Color+Color Theory+Creative+Fine Art+Graphic Design+Skillshare Original+Typography+Visual Communication+Visual Design"
692408885,"Sexy Signup Pages: A Fun Guide to Customising Newsletter Subscription Pages","Communication+CSS+HTML+Marketing+Technology+Web Design+Web Development"
692704396,"beginning with gouache | create a stay-wet palette, smooth gradients & paint a landscape","Art+Creative+Fine Art+Gouache+Illustration+Painting+Visual Arts+Watercolors"
693020127,"Printmaking at Home: Creating Linocut Wrapping Paper & Gift Tags","Art+Crafts+Creative+DIY+Graphic Design+Illustration+Printmaking+Surface Pattern Design"
693178791,"Introduction to Arduino: Creating Interactive Projects","Arduino+Creative+Electrical Engineering+Electronics+Product Design+Prototyping+Skillshare Original+UI/UX Design"
694410255,"Portrait Photography on the Street: Connecting with Strangers","Creative+Digital Photography+Photographic Composition+Photography+Portrait Photography+Skillshare Original+Street Photography"
695244560,"Fundamentals of Adobe Illustrator for Web Design: Getting Started with the Basics (I)","Adobe Illustrator+Creative+Skillshare Original+UI Design+UI/UX Design+Web Design"
698756370,"How To Customize Fonts For Logo Design","Adobe Illustrator+Creative+Graphic Design+Logo+Logo Design+Typography"
699269711,"Writing Suspense: How to Write Stories That Thrill in Any Genre","Comics+Creative+Creative Writing+Fiction+Screenwriting+Short Story+Skillshare Original+Suspense"
699304733,"Watercolor Butterflies","Creative+Design Techniques+Illustration+Painting+Sketchbook+Watercolors+Wet On Wet"
699963947,"Photoshop for Lunch™ - Grid Collage for Social Media - Clipping masks, Shapes & Layer Styles","Adobe Photoshop+Creative+Digital Illustration+Digital Photography+Graphic Design+Illustration+Photo Editing"
700467999,"Brine Time: Pickle like a Pro","Culinary+Lifestyle+Pickling+Recipe Design+Skillshare Original"
703219666,"Watercolor Textures for Graphic Design","Adobe Photoshop+Creative+Design+Digital Illustration+Graphic Design+Illustration+Texture+Watercolors"
708093439,"Advanced Shopify Theme Development","Creative+Ecommerce+Shopify+Skillshare Original+UI/UX Design+Web Design"
709797291,"The Freelancing Guide: Managing your Finances","Business+Entrepreneurship+Finance+Freelance & Entrepreneurship+Freelancing+Money Management+Small Business"
710497789,"Unique Lettering with Watercolors I","Brainstorming+Calligraphy+Creative+Handwriting+Illustration+Layout Design+Lettering+Watercolors+Wedding"
711034405,"Just Make Stuff: Getting Creative with Side Projects","Creative+Creativity+Graphic Design+Hand Lettering+Illustration+Lettering+Skillshare Original"
711318391,"Illustrator for Lunch™ - Creative Half tone Effects","Adobe Illustrator+Creative+Design Skills+Design Techniques+Digital Illustration+Graphic Design+Pattern Design+Surface Pattern Design+Textures"
711751852,"Create and Publish Your Design Look Book | Working in Adobe Indesign and Illustrator","Creative+Design Projects+Graphic Design+Illustration+Layout Design+Look Book+Page Layout+Pattern Design"
714999257,"Draw a Circus of Characters: Exploring Body Shape and Proportion","Character Animation+Character Design+Concept Design+Creative+Drawing+Figure Drawing+Illustration+Visual Arts"
715204524,"Executing Strategy: Tactics for Operational Excellence","Business+Business Development+Leadership+Management+Project Management+Skillshare Original+Strategic Planning+Women's Leadership"
716440051,"Pattern Play: Layered Designs","Creative+Design Patterns+Drawing+Illustration+Pattern Design+Surface Design+Surface Pattern Design"
717892532,"Resource Class: How to Use Think Kit","Creative+Design+Drawing+FiftyThree+Think Kit+Visual Communication+Visual Thinking"
724220607,"Fearless Art Jumpstart: A 14-Day Drawing Challenge to Unlock Your Creative Self","Creative+Creativity+Drawing+Fine Art+Illustration+Painting+Sketchbook+Watercolors"
726425957,"Procreate Fundamentals: Everything You Didn't Realize You Wanted to Know","Creative+Digital Illustration+Drawing+Illustration+Ipad+Lettering+Procreate+Retouching"
727221628,"Pattern Recipes: How to Create Pattern Templates You Can Reuse","Adobe Illustrator+Adobe Photoshop+Creative+Creative Insights+Design Techniques+Graphic Design+Pattern Design+Productivity+Surface Design"
727540537,"Create Your Own Custom Procreate Brushes","Creative+Drawing+Graphic Design+Illustration+Ipad+Procreate+Sketch+Sketching"
729504271,"Watercolour Christmas Patterns: Master Your Brush Control","Art+Creative+Fine Art+Illustration+Painting+Watercolor+Watercolor Painting+Watercolors"
730706816,"Complementary Color Cocktails: Photograph Glass, Liquid, and Smoke","Color Theory+Creative+Digital Photography+Dslr+Photographic Composition+Photography+Studio Setup+Styling+Visual Design"
730922294,"Spark creativity with your kids!","Character Design+Creative+Creative Insights+Creativity+Doodling+Drawing+Illustration+Kids+Painting"
731120029,"Cultivating Long-Term Influence: From Personal Brand to Lifestyle Business","Blogging+Business+Career Development+Freelance & Entrepreneurship+Instagram+Marketing+Personal Branding+Skillshare Original"
732291686,"Illustrator for Lunch™ - Cutout Text Effects - Photos, Pathfinder & Text","Adobe Illustrator+Creative+Design Skills+Digital Illustration+Graphic Design+Illustration+Typography+Visual Effects"
732749904,"painting watercolor resist crystals","Art+Creative+Creativity+Design+Design Techniques+Drawing+Illustration+Watercolors"
734122622,"Fluffy Foxes in Watercolor","Beginner+Character Design+Creative+Illustration+Painting+Watercolor Painting+Watercolors"
734650498,"Metallic Magic: Create Digital Foil Textures From Scratch!","Adobe Photoshop+Creative+Design+Foil+Graphic Design+Pattern Design+Texture"
735896748,"Watercolor Basics: How to Paint Floral Greenery","Art+Color Theory+Creative+Fine Art+Illustration+Painting+Sketching+Surface Pattern Design+Watercolors"
735964271,"Illustrator for Lunch™ - Braids, Rick Rack and More","Adobe Illustrator+Brushes+Creative+Design Techniques+Digital Illustration+Graphic Design+Illustration+Pattern Design+Vector Graphics"
736318919,"Javascript Fun: Build a Tip Calculator!","CSS+HTML+Javascript+Programming+Technology+Web Development"
737296534,"Illustrator for Lunch™ - Create a Retro Landscape Illustration","Adobe Illustrator+Creative+Digital Illustration+Editorial Design+Graphic Design+Illustration+Landscape+Vector Art"
738118362,"Photoshop for Lunch™ - Intro to Photoshop Actions","Adobe Photoshop+Creative+Digital Illustration+Digital Photography+Graphic Design+Illustration+Photo Editing"
738218535,"Characters in a Scene: Sketch to Digital","Adobe Photoshop+Character Design+Concept Art+Concept Design+Creative+Digital Illustration+Illustration+Skillshare Original"
741913781,"How to Paint a Watercolor Floral Wreath","Art+Creative+Fine Art+Painting+Watercolors"
744776180,"Illustrator for Lunch™ - Season's Greetings - Shapes, Brushes, Texture","Adobe Illustrator+Creative+Design Skills+Digital Illustration+Graphic Design+Illustration+Vectors+Vintage Design"
747136601,"Green Little Secret: plant in a bottle that carries special meaning too! (no need for green fingers)","Crafts+Green+Interior+Interior Design+Lifestyle+Plant"
747154273,"Shading Letters in Illustrator","Adobe Illustrator+Creative+Design+Graphic Design+Hand Lettering+Illustration+Lettering+Typography"
748681792,"Illustrator for Lunch™ - Gradient Background Effects  - Find, Adapt, Create & Use","Adobe Illustrator+Creative+Digital Illustration+Graphic Design+Illustration+Logo Design"
748999642,"Expressive Illustration: From Ideas to Execution","Creative+Digital Illustration+Drawing+Editorial Illustration+Graphic Design+Illustration+Skillshare Original"
754903647,"Watercolor Picnic Basket: Easy and Fun Watercolor Project","Creative+Fine Art+Illustration+Journaling+Painting+Sketching+Summer Art+Watercolors"
755037461,"Character Design Crash Course: Designing Animal Characters","Adobe Photoshop+Caricature+Character Design+Creative+Digital Illustration+Digital Painting+Drawing+Illustration"
755202419,"How to Draw the Head From Every Angle: Part Two","3D Modeling+Art+Character Animation+Character Design+Creative+Illustration+Polymer Clay"
763465688,"Audio Mixing on the Go: Professional Sound Without the Studio","Creative+Music Composition+Music Education+Music Industry+Music Production+Music Technology+Skillshare Original"
764285899,"Webcomics Essentials: Drawing Comics Using Photo Reference","Comic+Comic Art+Concept Art+Creative+Graphic Design+Skillshare Original"
765595626,"Lifestyle Photography: Immersive Storytelling with Photo Albums","Adventure Photography+Creative+Digital Photography+Editorial Photography+Lifestyle Photography+Photography+Sharing Photos+Storytelling+Visual Storytelling"
771082917,"Design a Superhero Logo","Comic Art+Creative+Design Thinking+Graphic Design+Logo Design+Sketch+Typography+Vector Graphics"
771119874,"Sketching With Markers: Draw a Sweet Cupcake","Art+Creative+Drawing+Illustration+Markers+Sketchbook+Sketching"
771298205,"Expressive Brush Pen Florals","Color Theory+Creative+Drawing+Fine Art+Illustration+Watercolors"
771362251,"Animating Morphing Icons in After Effects","2d Animation+Adobe After Effects+Adobe Illustrator+Animation+Creative+Gifs+Icon Design+Motion Graphics"
771669373,"Modern CSS: Writing Better, Cleaner, More Scalable Code","Coding+CSS+ITCSS+Programming Foundations+Skillshare Original+Technology+Web Development"
771767225,"Digital Illustration: Design Your Avatar","Adobe Illustrator+Creative+Digital Illustration+Drawing+Graphic Design+Illustration+Skillshare Original"
772047744,"Premiere Pro Lumetri 2020: Color Correct & Color Grade like a Pro","Adobe Premiere+Color Correction+Color Grading+Creative+Film & Video+Lumetri+Premiere Pro+Video Editing"
772204625,"Digitize Your Lettering with Adobe Illustrator","Adobe Illustrator+Brush Lettering+Creative+Graphic Design+Lettering"
774191846,"Mastering Logo Design: Gridding with the Golden Ratio","Adobe Illustrator+Branding+Creative+Graphic Design+Illustration+Logo Design+Skillshare Original"
774572547,"Photoshop for Lunch™ - Isometric Cube Patterns - Shapes, Repeat patterns, Smart Objects","Adobe Photoshop+Creative+Digital Illustration+Graphic Design+Illustration+Surface Pattern Design"
774800337,"Become A Greeting Card Designer","Creative+Digital Illustration+Graphic Design+Greeting Card+Illustration+Print Design+Staff Pick+Surface Pattern Design"
776732001,"From Everyday to Extraordinary: Paint a Lighthouse 3 ways in Watercolor","Collage+Creative+Illustration+Painting+Sketch+Sketchbook+Surface Design+Watercolors"
776870522,"Simple Character Lip Sync","Adobe After Effects+Adobe Illustrator+Animation+Creative+Digital Illustration+Graphic Design+Illustration+Skillshare Original"
777246880,"Javascript Fun: Build a Number Comparison Game!","CSS3+HTML5+Javascript+Technology+Web Development"
777849086,"Dark & Moody Food Photography for Instagram Success: Visual Storytelling with Emotional Food Photos","Creative+Digital Photography+Editorial Photography+Food Photography+Instagram+Lifestyle Photography+Photography+Visual Arts+Visual Storytelling"
778108715,"Be Your Own Boss: Strategies for Launching Your Creative Career","Business+Design Skills+Entrepreneurship+Freelance & Entrepreneurship+Freelancing+Lettering"
779606638,"Watercolor Florals -Orchids","Creative+Design+Florals+Flowers+Illustration+Painting+Watercolors"
780297279,"Illustrator for Lunch™ - Whimsical diagonal line patterns","Adobe Illustrator+Creative+Design Skills+Doodle+Graphic Design+Plugin+Scrapbooking+Surface Pattern Design+Vector Art"
780340623,"Ink and Watercolor Greeting Cards on Your iPad in Procreate + FREE Templates and Brushes","Creative+Digital Illustration+Digital Painting+Drawing+Greeting Card+Illustration+Ipad"
780681762,"Illustrator for Lunch™ - 20 Color tips in 20 Minutes","Adobe Illustrator+Color+Creative+Design Techniques+Digital Illustration+Fashion Illustration+Graphic Design+Surface Pattern Design+Vector Graphics"
781519267,"Procreate® Animation for Illustrators and Surface Designers: Make your Artwork Pop!","Animation+Creative+Digital Art+Digital Illustration+Gifs+Illustration+Procreate+Surface Pattern Design"
782118657,"Programming Graphics I: Introduction to Generative Art","Digital Patterns+Pattern Making+Processing+Programming+Technology+Web Development"
783298823,"Photoshop for Lunch™ - Pattern Bombing Effect - Patterns, Selections, Mask, Warp, Vanishing Point","Adobe Photoshop+Art+Creative+Digital Illustration+Digital Photography+Graphic Design+Illustration"
783804762,"Hand Lettering: Adding Flair & Embellishments","Calligraphy+Creative+DIY+Drawing+Hand Lettering+Illustration+Lettering+Visual Arts"
784048048,"Cinematography Basics: Understanding Filmmaking Style","Cinematography+Creative+Digital Photography+Film Production+Filmmaking+Short Films+Skillshare Original+Video Editing"
784313854,"Embossing 101","Calligraphy+Crafts+Creative+DIY+Embossing+Hand Lettering+Illustration+Lettering+Lifestyle"
788458862,"Design an Adult Coloring Book Page on Your iPad in Procreate + FREE Coloring Pages & Practice Sheets","Creative+Digital Illustration+Digital Painting+Drawing+Graphic Design+Illustration+Ipad+Sketching"
788682701,"Photoshop for Lunch™ - Create an Award Badge and Ribbon - Shapes, Warp, Rotate","Adobe Photoshop+Creative+Digital Illustration+Graphic Design+Illustration+Logo Design"
789027473,"Urban Sketching for Beginners: One - Point Perspective","Creative+Drawing+Fine Art+Illustration+Perspective+Travel Journal+Urban Sketching+Watercolors"
789249696,"Painting Skin Tone With Watercolors","Art+Creative+Fine Art+Painting+Watercolor+Watercolors"
789955501,"Digital Lettering Made Simple in Adobe Illustrator","Adobe Illustrator+Adobe Photoshop+Creative+Digital Illustration+Illustration+Lettering+Skillshare Original+Typography"
791155630,"Learn to Paint Winter Wreaths in Watercolor","Christmas+Creative+Fine Art+Painting+Watercolor Painting+Watercolors"
793415436,"Make Colorful Textures and Backgrounds with Acrylic Paint","Acrylic+Art+Color+Crafts+Lifestyle+Painting+Surface Design"
793640770,"How to Draw & Paint Animal Eyes in Watercolor","Animals+Creative+Drawing+Figure Drawing+Fine Art+Pets+Sketchbook+Watercolors"
793796694,"YouTube For Beginners","Camtasia+Creative+Film & Video+Film Editing+Filmmaking+Personal Branding+Premiere Pro+Videography+Youtube"
